CNPJ,Nome,Fantasia,Tipo_Logradouro,Logradouro,Número,Município,Bairro,UF,Telefone,Situação,Latitude,Longitude
00174998000140,JOSE CICERO DO NASCIMENTO,FARMAVIDA,AVENIDA,CAETANO MONTEIRO,557,GAMELEIRA,CENTRO,PE,,ATIVA,-8.58962182696,-35.433522804572
07217721000105,W M SANTOS AGOSTINHO GAMELEIRA LTDA,,PRAÇA,AGAMENON MAGALHAES,222,GAMELEIRA,CENTRO,PE,,ATIVA,-8.582372758444,-35.38673521391
07156838000118,ANDIARA COMERCIO DE MEDICAMENTOS LTDA,FARMACIA RENASCER,RUA,ANDRE VIDAL DE NEGREIROS,BOX 25,GARANHUNS,SOA JOSE,PE,,ATIVA,-8.883531679078,-36.492183961916
05230009000293,COMERCIAL DRUGSTORE LTDA,FARMACIA PERMANENTE,AVENIDA,SANTO ANTONIO,305,GARANHUNS,SANTO ANTONIO,PE,,ATIVA,-8.891198778506,-36.494502919428
05230009003209,COMERCIAL DRUGSTORE LTDA,FARMACIA PERMANENTE,AVENIDA,SANTO ANTONIO,537,GARANHUNS,SANTO ANTONIO,PE,,ATIVA,-8.891362163843,-36.496365451175
05230009001699,COMERCIAL DRUGSTORE LTDA,FARMACIA PERMANENTE,PRACA,DUQUE DE CAXIAS,14,BEZERROS,CENTRO,PE,,ATIVA,-8.234798008685,-35.752397498932
09068674000100,DROGA RAPIDA LTDA - FALIDO,DROGA RAPIDA,RUA,MAURICIO DE NASSAU,03,GARANHUNS,SANTO ANTONIO,PE,,ATIVA,-8.891742063669,-36.495522848604
06198619003316,DROGATIM DROGARIAS LTDA,FARMACIA PERMANENTE,AVENIDA,RUI BARBOSA,550,GARANHUNS,HELIOPOLIS,PE,,ATIVA,-8.884888402598,-36.48262777202
06198619001020,DROGATIM DROGARIAS LTDA,FARMACIA PERMANENTE,AVENIDA,SANTO ANTONIO,179,GARANHUNS,SANTO ANTONIO,PE,,ATIVA,-8.891041012896,-36.493051506809
06626253047700,EMPREENDIMENTOS PAGUE MENOS S/A,FARMACIA PAGUE MENOS,AVENIDA,SANTO ANTONIO,129,GARANHUNS,SANTO ANTONIO,PE,,ATIVA,-8.890953296279,-36.492563931501
11389744000166,ERIVALDO COSTA DA SILVA,FARMACIA SANTA QUITERIA,RUA,DO COMERCIO,58,GARANHUNS,SAO PEDRO,PE,,ATIVA,-8.8464,-36.45787
08778219000390,FARMACIA SANTA ANA LTDA,,AVENIDA,SANTO ANTONIO,412,GARANHUNS,CENTRO,PE,,ATIVA,-8.892369,-36.496348
10115210000340,J SANTOS & SIQUEIRA LTDA,DHFARMA,AVENIDA,SANTO ANTONIO,215,GARANHUNS,SANTO ANTONIO,PE,,ATIVA,-8.891059795477,-36.49373285985
09029901000180,SAO JORGE MEDICAMENTOS LTDA,,AVENIDA,DUQUE DE CAXIAS,492,GARANHUNS,HELIOPOLIS,PE,,ATIVA,-8.884946992102,-36.468588670934
14553456000274,KJ MEDICAMENTOS LTDA,SAO JORGE MEDICAMENTOS,TRAVESSA,JOSE LEITAO,624,GARANHUNS,ALOISIO SOUTO PINTO,PE,,ATIVA,-8.901076745396,-36.493782540777
14553456000193,KJ MEDICAMENTOS LTDA,SAO JORGE MEDICAMENTOS,AVENIDA,DUQUE DE CAXIAS,274,GARANHUNS,HELIOPOLIS,PE,,ATIVA,-8.884726715686,-36.4694728779
06221416000116,FARMACIA SETE COLINAS LTDA,FARMACIA SETE COLINAS,PRACA,IRMAOS MIRANDA,46,GARANHUNS,SANTO ANTONIO,PE,,ATIVA,-8.890743287695,-36.497072724857
15864599000189,GUERRA E OLIVEIRA FARMACIA LTDA,FARMACIA POPULAR DOS TRABALHADORES,RUA,QUINZE DE NOVEMBRO,79,GLORIA DO GOITA,CENTRO,PE,,ATIVA,-8.000822224846,-35.296062767623
01074586000100,WASHENGTON FERREIRA DA SILVA FILHO - FARMACIA,,RUA,CLETO CAMPELO,137,GLORIA DO GOITA,CENTRO,PE,,ATIVA,-7.999449561877,-35.295199653866
09521904000137,ADILENE LUCIA MENDES ALVES,FARMACENTER,RUA,SILVINO MACEDO,15,GOIANA,CENTRO,PE,,ATIVA,-7.560921896687,-34.999401814382
06626253066926,EMPREENDIMENTOS PAGUE MENOS S/A,FARMACIA PAGUE MENOS,RUA,BENJAMIM CONSTANT,75,GOIANA,CENTRO,PE,,ATIVA,-7.559908916037,-35.000958328601
04699330000178,FARMACIA PRESTIGIO LTDA,FARMACIA PRESTIGIO,RUA,DO POCO,371,GOIANA,PONTA DE PEDRAS,PE,,ATIVA,-7.564816326108,-34.988867993452
00688141000149,MENDES MEDICAMENTOS LTDA,,PRACA,JOAO PESSOA,12,GOIANA,CENTRO,PE,,ATIVA,-7.559112200929,-34.998712768098
06270525000123,FARMACIA PONTAS DE PEDRA LTDA,,RUA,DO MEIO,184,GOIANA,PONTA DE PEDRAS,PE,,ATIVA,-7.637104812174,-34.815713442188
37147383000135,FARMA MP GRANITO LTDA,FARMACIA MADRE PAULINA,RUA,CARLOS CORNELIO ALENCAR,02,GRANITO,CENTRO,PE,,ATIVA,-7.714959477194,-39.615140107272
05662560000125,EDNALDO FERREIRA DA COSTA,FARMACIA SANTA FELICIDADE,RUA,DOUTOR AMAURY DE MEDEIROS,364,GRAVATA,BOA VISTA,PE,,BAIXADA,-8.216064384831,-35.557298482296
04081670000211,FARMACIA 10 LTDA,FARMACIA 10,RUA,RUI BARBOSA,85,GRAVATA,CENTRO,PE,,ATIVA,-8.119094594437,-35.297461699367
04081670000130,FARMACIA 10 LTDA,FARMACIA 10,PRACA,PEDRO JOAQUIM DE SOUZA,61,GRAVATA,CENTRO,PE,,ATIVA,-8.51077099727,-35.385232463193
11707881000100,M. P. DA SILVA FARMACIA LTDA,FARMACIA 10,PRAÇA,AARAO LINS DE ANDRADE,48,GRAVATA,CENTRO,PE,,ATIVA,-8.1943416,-35.5620522
02617932000707,ROMERO FARMACIA LTDA,FARMACIA NATHALLY,RUA,CLETO CAMPELO,39,GRAVATA,CENTRO,PE,,ATIVA,-8.206278988587,-35.58248449004
17687598000131,MARCELO FERREIRA SANTOS FARMACIA LTDA,FARMACIA SANTANA,AVENIDA,GOVERNADOR AGAMENON MAGALHAES,28,GRAVATA,PRADO,PE,,ATIVA,-8.200025472017,-35.564489305115
15156220000186,VIVA FARMACIA LTDA,DROGARIAS ULTRA POPULAR,AVENIDA,GOVERNADOR AGAMENON MAGALHAES,106,GRAVATA,PRADO,PE,,ATIVA,-8.200454326039,-35.56507832164
10550440000176,JOELMA MOREIRA LUCAS E CIA LTDA,,AVENIDA,MANOEL ALVES,254,IATI,CENTRO,PE,,ATIVA,-9.045443790293,-36.846532525106
11480286000176,MACIANA TENORIO SANTANA ARAUJO,FARMACIA LUZ,AVENIDA,TAB. MANOEL TENORIO ALVES,151,IATI,CENTRO,PE,,ATIVA,-9.045050509173,-36.84686899749
08794422000198,ADAUTO GOMES & FILHOS LTDA,FARMACIA MAIS SAUDE,AVENIDA,CASTRO ALVES,309,IBIMIRIM,CENTRO,PE,,ATIVA,-8.538099815388,-37.689301389125
49114799000136,SAMARA GOMES DA SILVA PRODUTOS FARMACEUTICOS,FARMA BRASIL,AVENIDA,CASTRO ALVES,317,IBIMIRIM,CENTRO,PE,,ATIVA,-8.538191868054,-37.689078072299
28686058000150,VANDERLI BESERRA DE OLIVEIRA,COMFARMA,RUA,SANTA IZABEL,240,IBIMIRIM,CENTRO,PE,,ATIVA,-8.535071201057,-37.694976428937
03913572000230,RODRIGUES COMERCIO DE PRODUTOS FARMACEUTICOS LTDA,FARMACIA RODRIGUES,RUA,PEDRO TRIBUTINO,41,IBIRAJUBA,CENTRO,PE,,ATIVA,-8.580772697611,-36.179031608989
02693283000120,CRISTIANO BRAGA GADELHA DE ALBUQUERQUE,FARMACIA POPULAR,AVENIDA,BARAO DE VERA CRUZ,03,IGARASSU,CRUZ DE REBOUCAS,PE,,ATIVA,-7.871496384632,-34.906251137933
69891786000180,DECIO ROBERTO BRAGA GADELHA DE ALBUQUERQUE,,AVENIDA,BARAO DE VERA CRUZ,765,IGARASSU,CRUZ DE REBOUCAS,PE,,ATIVA,-7.882872673705,-34.904558027708
10857260000131,REDE CENTER FARMA LTDA,CENTER FARMA,RUA,LUCIANO PAIVA DE SOUZA,413,IGARASSU,CRUZ DE REBOUCAS,PE,,ATIVA,-7.874092937268,-34.909728458299
10629649000200,SEBASTIAO GADELHA DE ALBUQUERQUE FILHO LTDA,FARMACIA DO POVO,RUA,JOAQUIM NABUCO,04,IGARASSU,CENTRO,PE,,ATIVA,-7.831501510611,-34.909511909181
10992357000157,SERV'BEM FARMA PRODUTOS FARMACEUTICOS LTDA,SERV'BEM FARMA,AVENIDA,BARAO DE VERA CRUZ,1315,IGARASSU,CRUZ DE REBOUCAS,PE,,ATIVA,-7.871496384632,-34.906251137933
41274781000190,EVERTON RODRIGUES BEZERRA,IGUARACYMED,RUA,HERCILIO DE CARVALHO VERAS,30,IGUARACY,CENTRO,PE,,ATIVA,-7.836051596368,-37.513835073139
10972988000104,JEANE CRISTINA DE BRITO MORAIS,DROGAFARMA,RUA,HERCILIO CARVALHO VERAS,28,IGUARACY,CENTRO,PE,,ATIVA,-7.836029455086,-37.513841016361
14173001000142,FARMACIA BRASIL LTDA,FARMACIA BRASIL,RUA,PADRE MACHADO,48,ILHA DE ITAMARACA,PILAR,PE,,ATIVA,-7.747043146609,-34.824286713898
70240874000100,DANILA LINS SILVA,FARMACIA SANTANA MAIS,RUA,JOSE MALAQUIAS,36,INAJA,CENTRO,PE,,ATIVA,-8.901361475774,-37.825225977707
24095796000171,FARMACIA APOLONIO LTDA,FARMACIA APOLONIO,RUA,LUIZ COSTA,130,IPOJUCA,NOSSA SENHORA DO O,PE,,ATIVA,-8.440298511852,-35.014911766637
02088650000166,FARMACIA RIBEIRO LTDA,FARMACIA RIBEIRO,RUA,JOAO RUFINO DE SOUZA,28,IPOJUCA,CENTRO - NOSSA SENHORA DO O,PE,,ATIVA,-8.445191196373,-35.019643518617
05087206000114,M R DROGARIA LTDA,DROGARIA POUPE JA,PRACA,DO MERCADO,82,IPOJUCA,NOSSA SENHORA DO O CENTRO,PE,,ATIVA,-8.4425,-35.01222
07790324000209,P PABLO & SUELEIDE LTDA,PHARMACIA NOSSA SENHORA DE FATIMA,PRACA,CEL. FRANCISCO MARTINS,34,ITAIBA,CENTRO,PE,,ATIVA,-8.947999544417,-37.422622841514
02634602000126,ALINE DE PONTES RODRIGUES FARMACIA,FARMACIA SANTA MADALENA,RUA,ANTONIO GOMES COUTINHO,48,ITAMBE,VILA IBIRANGA,PE,,ATIVA,-7.3775,-35.24306
02639558000147,GOMES & SILVA PRODUTOS FARMACEUTICOS LTDA,FARMA FACIL,RUA,DA PENHA,120,ITAMBE,CENTRO,PE,,ATIVA,-7.412640779498,-35.109231283766
12651074000177,A&B PRODUTOS FARMACEUTICOS LTDA,FARMA FACIL,AVENIDA,VINTE E NOVE DE DEZEMBRO,382,SANTA CRUZ DO CAPIBARIBE,NOVO,PE,,ATIVA,-7.955916905445,-36.205344272622
08797115000160,ALEXANDRE PEDRO DE LIMA,,RUA,PAULINO SOARES,95,ITAPETIM,CENTRO,PE,,ATIVA,-7.377049518019,-37.195845965013
23637727000180,DANILO DE L SILVA,CLINFARMA SAO PEDRO,RUA,SAO PEDRO,30,ITAPETIM,CENTRO,PE,,ATIVA,-7.379885307839,-37.189067170428
02908137000174,FARMACIA SAO GONCALO LTDA,FARMACIA SAO GONCALO,AVENIDA,FREI SERAFIM,19,ITAPISSUMA,CENTRO,PE,,ATIVA,-7.773410679704,-34.895935713618
41091885000169,FARMACIA AVENIDA ITAQUITINGA LTDA,FARMACIA AVENIDA,AVENIDA,ANTONIO C DE ALMEIDA,291,ITAQUITINGA,CENTRO,PE,,ATIVA,-7.664904808205,-35.10070321313
07676987000108,DOLORES M DE O MORAES - FARMACIA,FARMACIA E DROGARIA DO TRABALHADOR,RUA,DA PATRIA,94,ITAQUITINGA,CENTRO,PE,,ATIVA,-7.664171146079,-35.102415309948
06076281000142,ACCIOLY COMERCIO FARMACEUTICO LTDA,FARMACIA DO TRABALHADOR,AVENIDA,ARMINDO MOURA,391,JABOATAO DOS GUARARAPES,PIEDADE,PE,,ATIVA,-8.148074445275,-34.91573946375
05737832000109,BELTRAO FARMACIA LTDA,G FARMA,RUA,DOUTOR ANICETO VAREJAO,100,JABOATAO DOS GUARARAPES,CANDEIAS,PE,,ATIVA,-8.191371256862,-34.919028506502
01515342000107,D C DA ROCHA LTDA,FARMACIA SANTA ROSA,AVENIDA,GENERAL MANOEL RABELO,5179,JABOATAO DOS GUARARAPES,CAVALEIRO,PE,,ATIVA,-8.097243894868,-34.967842099707
83754234018360,DISTRIBUIDORA BIG BENN SA FALIDO,,AVENIDA,GOVERNADOR AGAMENON MAGALHAES,950,JABOATAO DOS GUARARAPES,CAVALEIRO,PE,,INAPTA,-8.092688791497,-34.97249229577
83754234017984,DISTRIBUIDORA BIG BENN SA FALIDO,,AVENIDA,BARRETO DE MENEZES,800,JABOATAO DOS GUARARAPES,PRAZERES,PE,,INAPTA,-8.157045085988,-34.934373914699
61412110060565,DROGARIA SAO PAULO S.A.,DROGARIA SAO PAULO,AVENIDA,SANTOS DUMONT,1415,LONDRINA,BOA VISTA,PR,,ATIVA,-23.32436299572,-51.141304472061
61412110059982,DROGARIA SAO PAULO S.A.,DROGARIA SAO PAULO,AVENIDA,PIRES DO RIO,1856,SAO PAULO,JARDIM SAO SEBASTIAO,SP,,ATIVA,-23.514134815668,-46.444053494578
06626253058079,EMPREENDIMENTOS PAGUE MENOS S/A,FARMACIA PAGUE MENOS,AVENIDA,BERNARDO VIEIRA DE MELO,3000,JABOATAO DOS GUARARAPES,PIEDADE,PE,,ATIVA,-8.179643199863,-34.917919400576
06626253012320,EMPREENDIMENTOS PAGUE MENOS S/A,,,DR. ANICETO VAREJAO,100,JABOATAO DOS GUARARAPES,PIEDADE,PE,,ATIVA,-8.191371256862,-34.919028506502
06626253018360,EMPREENDIMENTOS PAGUE MENOS S/A,FARMACIA PAGUE MENOS,AVENIDA,AYRTON SENNA DA SILVA,2674,JABOATAO DOS GUARARAPES,PIEDADE,PE,,ATIVA,-8.157565307209,-34.912353125265
06626253011609,EMPREENDIMENTOS PAGUE MENOS S/A,FARMACIA PAGUE MENOS,AVENIDA,BARRETO DE MENEZES,419,JABOATAO DOS GUARARAPES,CAJUEIRO SECO,PE,,ATIVA,-8.162865018548,-34.925597391522
07128190000176,FARMACIA TALENTO LTDA,FARMACIA TALENTO,RUA,CORONEL CAMARA LIMA,95,JABOATAO DOS GUARARAPES,CENTRO,PE,,ATIVA,-8.113343519211,-35.017658013393
35529981000143,JOSIANE BARBOSA SOUZA,FARMACIA IDEAL,RUA,HELIO LOBO COSTA,85-A,JABOATAO DOS GUARARAPES,CAVALEIRO,PE,,ATIVA,-8.081002616361,-34.972485674067
05255399000256,LILIANE BARBOSA DE SOUZA FARMACIA,DROGARIA RECIFE,AVENIDA,MARIA IRENE,255,RECIFE,JORDAO,PE,,ATIVA,-8.137858909619,-34.936288006108
05255399000175,LILIANE BARBOSA DE SOUZA FARMACIA,DROGARIA RECIFE,RUA,PADRE OLIVEIRA,602,RECIFE,ALTO JOSE DO PINHO,PE,,ATIVA,-8.0211903,-34.9078114
14683922000155,MV FARMACIA POPULAR COMERCIO FARMACEUTICO LTDA,M V FARMACIA POPULAR,AVENIDA,DOLORES DURAN,68,JABOATAO DOS GUARARAPES,CURADO,PE,,ATIVA,-8.076802439929,-34.998798786424
12970751000381,FARMACIA DO TRABALHADOR DO JOAO MOTA LTDA,DROGARIA DO TRABALHADOR DO JOAO MOTA,RUA,SAO NICOLAU DE MIRA,461,CARUARU,JOAO MOTA,PE,,ATIVA,-8.280951806979,-35.987313614051
09646827002438,NEX DISTRIBUIDORA DE PRODUTOS FARMACEUTICOS S. A.,NEX DISTRIBUIDORA,AVENIDA,AYRTON SENNA DA SILVA,2221,JABOATAO DOS GUARARAPES,PIEDADE,PE,,INAPTA,-8.157565307209,-34.912353125265
09646827000303,NEX DISTRIBUIDORA DE PRODUTOS FARMACEUTICOS S. A.,NEX,AVENIDA,BERNARDO VIEIRA DE MELO,4146,JABOATAO DOS GUARARAPES,PIEDADE,PE,,INAPTA,-8.173937387186,-34.916513624035
07612158000161,TABOCAS PRODUTOS FARMACEUTICOS LTDA,DROGARIA JABOATAO,AVENIDA,BARAO DE LUCENA,284,JABOATAO DOS GUARARAPES,CENTRO,PE,,ATIVA,-8.113940749338,-35.023051759527
03160689000100,ZN FARMA LTDA,FARMACIAS INDEPENDENTE,PRACA,NOSSA SENHORA DO ROSARIO,472,JABOATAO DOS GUARARAPES,CENTRO,PE,,ATIVA,-8.112350357009,-35.017890507548
09548636000147,MARIA GORETTI DA SILVA GONCALVES,FARMACIA POPULAR,RUA,FRANCISCO PELLEGRINO,236,JAQUEIRA,CENTRO,PE,,ATIVA,-8.728940396949,-35.793088110958
10801096000140,FARMACIA SAO JERONIMO LTDA,FARMACIA SAO JERONIMO,AVENIDA,JOSE LOPES DE SIQUEIRA,222,JATAUBA,CENTRO,PE,,BAIXADA,-7.987952198534,-36.497626274127
09900903000101,JFL COMERCIO LTDA,FARMACIA NOSSA SENHORA DE FATIMA,AVENIDA,JOSE LOPES DE SIQUEIRA,107,JATAUBA,CENTRO,PE,,ATIVA,-7.987121690525,-36.49821407063
08329736000110,LUZIANA SIQUEIRA DE QUEIROZ,FARMACIA DO TRABALHADOR,RUA,SAO SEBASTIAO,190,JATAUBA,CENTRO,PE,,ATIVA,-7.989279157546,-36.497462816288
03351586000127,LAELSON VIRGULINO DA SILVA LTDA,FARMACIA JATOBA,AVENIDA,OLINDA,29,JATOBA,CENTRO,PE,,ATIVA,-8.06331605434,-34.871708372238
03264634000140,MANOEL RODRIGUES DE ARAUJO,FARMACIA IRMAOS ARAUJO,RUA,AGUA VERMELHA,S/N,JATOBA,ITAPARICA,PE,,ATIVA,-9.175661460443,-38.25098058713
06370315000298,M B DE MELO ARAGAO & CIA LTDA,,RUA,CORONEL JOSE FERREIRA DA SILVA,69,JOAO ALFREDO,BOA VISTA,PE,,ATIVA,-7.859395206192,-35.591671291112
40889719000140,S R SIMOES AMORIM SANTANA LTDA,,RUA,CORONEL JOSE FERREIRA DA SILVA,46,JOAO ALFREDO,CENTRO,PE,,ATIVA,-7.859536507954,-35.591834120548
00868902000144,RONALDO B SIMOES,,AVENIDA,MEIRA VASCONCELOS,435,JOAO ALFREDO,CENTRO,PE,,ATIVA,-7.8636377,-35.5907173
05329458000102,W. CAVALCANTI DOS SANTOS & CIA. LTDA,,RUA,CORONEL JOSE FERREIRA DA SILVA,58,JOAO ALFREDO,BOA VISTA,PE,,ATIVA,-7.859522460259,-35.591743740407
50325800000150,E. DE M. SANTOS PRODUTOS FARMACEUTICOS,DROGARIAS MORAIS,AVENIDA,RUI BARBOSA,141,JUCATI,CENTRO,PE,,ATIVA,-8.705883275378,-36.487691704494
41048170000123,RAUL CANDIDO DA SILVA,FARMACIA SANTA TEREZINHA,AVENIDA,RUI BARBOSA,55,JUCATI,CENTRO,PE,,ATIVA,-8.70606685273,-36.488411692505
11190463000180,GLECIO CARVALHO DE SOUZA E CIA LTDA,FARMACIA CANAA,AVENIDA,SIQUEIRA CAMPOS,237,CAMOCIM DE SAO FELIX,CENTRO,PE,,ATIVA,-8.359957601476,-35.763075953314
14246289000138,JESSICA MAIARA DA SILVA GOMES,FARMACIA SAUDE DO TRABALHADOR,RUA,JOSE CORREIA LIMA,175,JUPI,CENTRO,PE,,ATIVA,-8.240664166888,-35.75372063046
11069085000180,JOSE PORFIRIO DA SILVA,FARMACIA SANTA TEREZINHA,RUA,TENENTE DANTAS,21,JUREMA,CENTRO,PE,,ATIVA,-8.719414305483,-36.137556817073
01911653000195,MARIA MARLEIDE DOS SANTOS MUNIZ,FARMACIA NOSSA SENHORA APARECIDA,PRACA,DA CONCEICAO,69,JUREMA,CENTRO,PE,,ATIVA,-7.519437461927,-35.309053623715
04787789000123,DROGARIA RAMOS LTDA,DROGARIA RAMOS,AVENIDA,MANOEL DA CONCEICAO GONCALVES,75,CARUARU,BOA VISTA,PE,,ATIVA,-8.293983308104,-35.965791199955
01615386000109,DINALDO GOMES DA SILVA,FARMACIA SAUDE,RUA,MANOEL JOSE DA SILVA,05,LAGOA DE ITAENGA,CENTRO,PE,,ATIVA,-7.926003079827,-35.298823423357
24334138000195,FARMACIA ESTADO LTDA,,PRAÇA,MARIA AURORA,01,LAGOA DE ITAENGA,CENTRO,PE,,ATIVA,-7.934257910696,-35.292075373191
49313328000157,ADRIANO DOS SANTOS SILVA,FARMACIA DO POVO,RUA,JOSE MARIANO,39,LAGOA DO CARRO,CENTRO,PE,,ATIVA,-7.844056666776,-35.310555991432
48862085000143,FARMACIA CARDOSO DE MENEZES LTDA,FARMACIA 5 K,PRACA,DA SOLEDADE,07,LAGOA DO CARRO,CENTRO,PE,,ATIVA,-7.843769898625,-35.311349957617
11067136000135,FRANCLIN V. D . ALVES MEDICAMENTOS,FARMACIA VANDERLEI,RUA,DO PROGRESSO,209,LAGOA DO OURO,CENTRO,PE,,ATIVA,-9.125165505859,-36.461126933089
05442013000134,SILVERLAN FEITOSA QUINTINO FARMACIA,FARMACIA SAO JOSE,PRACA,DA CONCEICAO,114,LAGOA DO OURO,CENTRO,PE,,ATIVA,-9.124722899462,-36.458316900049
07821471000100,HELIO FABRICIO P DE AQUINO,HD FARMA,RUA,PROFESSOR MANOEL EDMUNDO,26,LAGOA DOS GATOS,CENTRO,PE,,ATIVA,-8.655304181273,-35.904400523973
03512968000195,MIXFARMA MEDICAMENTOS LTDA,MIXFARMA,AVENIDA,SETE DE SETEMBRO,46,LAGOA DOS GATOS,CENTRO,PE,,ATIVA,-8.648951427959,-35.904264149477
04432115000106,MARQUES & MEDEIROS LTDA,FARMACIA VIDA,AVENIDA,NILO COELHO,452,LAGOA GRANDE,CENTRO,PE,,ATIVA,-8.995057640619,-40.27157781569
03536923000150,NOVA FARMACIA DO POVO LTDA,NOVA FARMACIA DO POVO,RUA,DUQUE DE CAXIAS,160,LAJEDO,CENTRO,PE,,ATIVA,-8.668934167049,-36.322893117423
09148617000123,DROGARIA UNIPHARMA LTDA,DROGARIA UNIPHARMA,RUA,BARAO CAZUZA,58,LAJEDO,CENTRO,PE,,ATIVA,-8.662258140391,-36.322647147301
06626253035370,EMPREENDIMENTOS PAGUE MENOS S/A,FARMACIA PAGUE MENOS,RUA,LAURENTINO DE BARROS CORREIA,56,LAJEDO,CENTRO,PE,,ATIVA,-8.663246404505,-36.327287435749
07238917000178,PONTES E CARVALHO COMERCIO VAREJISTA DE PRODUTOS FARMACEUTICOS LTDA,DROGARIA FARMAVIDA,AVENIDA,EUDES TEIXEIRA DE CARVALHO,58,BARRA DE GUABIRABA,NOVA ESPERANCA,PE,,ATIVA,-8.41652362068,-35.665778785788
03018865000173,G M SANTOS LTDA,FARMACIA VITORIA,RUA,JOSE PEREIRA DE CARVALHO,20,LAJEDO,SANTO ANTONIO,PE,,ATIVA,-8.662785580606,-36.322175133222
07423209000107,FARMACIA VERDE LTDA,FARMACIA VERDE,RUA,JOSE PEREIRA DE CARVALHO,03,LAJEDO,CENTRO,PE,,ATIVA,-8.662852682026,-36.322306903841
04911911000121,M. I. SILVA MARTINS,FARMACIA VITORIA,RUA,BARAO DE CAZUZA,68,LAJEDO,CENTRO,PE,,ATIVA,-8.66163649534,-36.323774613591
03913572000150,RODRIGUES COMERCIO DE PRODUTOS FARMACEUTICOS LTDA,FARMACIA RODRIGUES,RUA,LAURENTINO BARROS CORREIA,18,LAJEDO,CENTRO,PE,,ATIVA,-8.663378898151,-36.327562230193
02920137000190,N INACIO DA SILVA LTDA,FARMACIA AVENIDA,AVENIDA,AGAMENON MAGALHAES,208,LAJEDO,CENTRO,PE,,ATIVA,-8.661881777,-36.321730211042
10886589000120,NELSON DOS SANTOS & CIA LTDA,DROGABELA,PRACA,JOAQUIM NABUCO,44,LAJEDO,CENTRO,PE,,ATIVA,-7.510350343414,-35.320400941386
02314106000195,C H LOURENCO DE ARAUJO & CIA LTDA,,AVENIDA,SANTO ANTONIO,189,LIMOEIRO,CENTRO,PE,,ATIVA,-7.879365709554,-35.454408058643
05829359000190,CLAUDIA F. DE LIRA FARMACIA,DROGARIA ECONOMICA,RUA,CORONEL MANOEL DE AQUINO ALBUQUERQUE,21,LIMOEIRO,JOSE FERNANDES SALSA,PE,,ATIVA,-7.880114144717,-35.450522668484
01591101000147,DROGAMIGA LTDA,,PRACA,COMENDADOR PESTANA,29,LIMOEIRO,CENTRO,PE,,ATIVA,-7.880168119274,-35.456555405619
02684562000127,ELANE CRISTINA RAMOS SILVA FARMACIA,DROGARIA PERMANENTE,RUA,SAO SEBASTIAO,398,LIMOEIRO,SAO SEBASTIAO,PE,,ATIVA,-7.868233043563,-35.442212990171
08156093000150,FARMACIA A CORUJINHA LTDA,,RUA,DA MATRIZ,257,LIMOEIRO,CENTRO,PE,,ATIVA,-7.880233404171,-35.454717434689
10777286000170,FARMACIA DUAS IRMAS LTDA,FARMACIA CENTRAL,PRAÇA,DA BANDEIRA,42,LIMOEIRO,CENTRO,PE,,ATIVA,-7.87738564278,-35.452958270711
03985021000100,J. A. DA FONSECA FILHO & CIA. LTDA,,PRACA,COMENDADOR PESTANA.,009,LIMOEIRO,CENTRO.,PE,,ATIVA,-7.880180391349,-35.456552062982
06989387000137,MARCELA B. DE MELO ARAGAO & CIA. LTDA,,AVENIDA,SANTO ANTONIO,369,LIMOEIRO,CENTRO,PE,,ATIVA,-7.879921681192,-35.455820996061
09256963000125,P. R. MEDICAMENTOS LTDA,,RUA,DA MATRIZ,6,LIMOEIRO,CENTRO,PE,,ATIVA,-7.879421784486,-35.453244399025
10298198000195,E. DIAS DA COSTA,POSTO DE MEDICAMENTOS SALVADOR,AVENIDA,JOAO FRANCISCO,200,MACAPARANA,B NOVO,PE,,ATIVA,-7.552648591224,-35.447780415687
35609247000194,EDIVALDO LEITE DA SILVA,FARMACIA CENTRAL,RUA,JOAO PESSOA,99,MACAPARANA,CENTRO,PE,,ATIVA,-7.553771518894,-35.450754889963
05460271000143,TRAVASSOS E ARRUDA FILHOS LTDA,FARMACIA MAIS SAUDE,RUA,MANOEL BORBA,67,MACAPARANA,CENTRO,PE,,ATIVA,-7.554544204639,-35.453082209198
05575267000120,EDVALDO & EDENIZE MEDICAMENTOS LTDA,FARMACIA E PERFUMARIA CENTRAL,AVENIDA,MANOEL PEDRO DE AGUIAR,140,MACHADOS,CENTRO,PE,,ATIVA,-7.68522265477,-35.517840193886
07790324000110,P PABLO & SUELEIDE LTDA,PHARMACIA NOSSA SENHORA DE FATIMA,RUA,VINTE E CINCO DE MARCO,7,MANARI,CENTRO,PE,,ATIVA,-8.96006074797,-37.62483379411
20334551000107,DROGARIA PEREIRA LTDA,FARMACIA DO TRABALHADOR REGIONAL,AVENIDA,FLORIANO GONCALVES DE LIMA,21,XEXEU,CENTRO,PE,,ATIVA,-8.80597576186,-35.626840982543
41038480000167,HONORINA PIRES DE CARVALHO & CIA LTDA,FARMACIA SANTA IZABEL,RUA,JOAO BARBOSA,17,MIRANDIBA,CENTRO,PE,,ATIVA,-8.119286909659,-38.728055678899
44361832000109,ANA BEATRIZ CANTARELLI DELMONDES,FARMACIA POPULAR,RUA,ROMAO SAMPAIO,166,MOREILANDIA,CENTRO,PE,,ATIVA,-7.63005492156,-39.549818390646
08089414000302,A B S ARAGAO & CIA LTDA,GENFARMA,AVENIDA,DR SOFRONIO PORTELA,3858,MORENO,CENTRO,PE,,ATIVA,-8.118852671719,-35.102944207387
02597537000106,FAUSTO E LINDAMAQUE PRODUTOS FARMACEUTICOS LTDA,FARMACIA AVENIDA,RUA,BOM JESES,75,NAZARE DA MATA,CENTRO,PE,,ATIVA,-8.062706800639,-34.871803772587
07483358000161,ROMARIO CONSTANTINO FERREIRA,FARMACIA SANTA JOANA,RUA,BOM JESUS,149 B,NAZARE DA MATA,CENTRO,PE,,INAPTA,-8.062224458444,-34.871538093639
03704687000215,AEFARMA MEDICAMENTOS LTDA,FARMASUL,AVENIDA,PRESIDENTE KENNEDY,2058,OLINDA,PEIXINHOS,PE,,ATIVA,-8.012864700525,-34.872591241669
05584991000110,D S MEDICAMENTOS LTDA,POPULAR FARMA,ESTRADA,DO CAENGA,105,OLINDA,SAO BENEDITO,PE,,ATIVA,-8.001284090275,-34.896157119531
61412110060646,DROGARIA SAO PAULO S.A.,DROGARIA SAO PAULO,AVENIDA,GETULIO VARGAS,1087,OLINDA,BAIRRO NOVO,PE,,ATIVA,-8.001968033519,-34.840342478589
06626253010890,EMPREENDIMENTOS PAGUE MENOS S/A,FARMACIA PAGUE MENOS,AVENIDA,PRES GETULIO VARGAS,00811,OLINDA,BAIRRO NOVO,PE,,ATIVA,-8.004485144915,-34.840841515241
06626253017046,EMPREENDIMENTOS PAGUE MENOS S/A,FARMACIAS PAGUE MENOS,AVENIDA,GOVERNADOR CARLOS LIMA CAVALCANTI,1748,OLINDA,CASA CAIADA,PE,,ATIVA,-7.992629065298,-34.842423496477
07286589000185,FARMACIA SAUDE PHARMA LTDA,FARMACIA SAUDE PHARMA,RUA,DOIS,2,OLINDA,RIO DOCE,PE,,ATIVA,-7.961222789232,-34.834603534469
07747368000167,GOLDFARMA PRODUTOS FARMACEUTICOS LTDA,GOLDFARMA,AVENIDA,PRESIDENTE KENNEDY,402,OLINDA,PEIXINHOS,PE,,ATIVA,-8.00124939438,-34.891759229308
09130688000107,J & E FARMA LTDA,FARMACIA JATOBA,RUA,ESQUILO,34,OLINDA,OURO PRETO,PE,,ATIVA,-7.988386475616,-34.860242264918
09646827000575,NEX DISTRIBUIDORA DE PRODUTOS FARMACEUTICOS S. A.,NEX,AVENIDA,PRESIDENTE GETULIO VARGAS,1301,OLINDA,BAIRRO NOVO,PE,,INAPTA,-8.000122704309,-34.84000026846
09646827000818,NEX DISTRIBUIDORA DE PRODUTOS FARMACEUTICOS S. A.,,AVENIDA,GOVERNADOR CARLOS DE LIMA CAVALCANTI,1787,OLINDA,CASA CAIADA,PE,,INAPTA,-7.992265869355,-34.842470995417
01415312000129,PRAZERES & FEITOSA LTDA,FARMOLINDA,AVENIDA,TIRADENTES,07,OLINDA,RIO DOCE,PE,,ATIVA,-7.959070316497,-34.851918115677
17470417000110,E & W COMERCIO DE MEDICAMENTOS LTDA,FARMACIA MENOR PRECO,AVENIDA,ESTACIO COIMBRA,35,OROBO,CENTRO,PE,,ATIVA,-8.4308189,-35.8078621
08181679000174,FARMACIA NOSSA SENHORA DA CONCEICAO LTDA,FARMACIA NOSSA SENHORA DA CONCEICAO,AVENIDA,GOVERNADOR ESTACIO COIMBRA,16,OROBO,CENTRO,PE,,ATIVA,-8.719282043932,-36.138532778954
15487589000171,OLIVEIRA PRODUTOS FARMACEUTICOS LTDA,FARMACIA SAO PEDRO,AVENIDA,GOVERNADOR AGAMENON MAGALHAES,12,OROBO,BAIRRO DA MATRIZ,PE,,ATIVA,-8.093047914139,-34.972672590507
15571021000134,ADNA BRUNA CALDAS LEITE,,AVENIDA,ULISSES DE NOVAES BIONE,122,OROCO,CENTRO,PE,,ATIVA,-8.621292172984,-39.599640489142
10973552000130,MARIA ALICE DIAS DE OLIVEIRA CAVALCANTE POSTO DE MEDICAMENTO,,AVENIDA,PREFEITO ULISSES DE NOVAES BIONE,269,OROCO,CENTRO,PE,,ATIVA,-8.6160244,-39.6005835
17703557000191,LENARTHE MARINHO MACEDO,OURIFARMA,AVENIDA,ANTONIO PEDRO DA SILVA,949,OURICURI,CENTRO,PE,,ATIVA,-7.885487951284,-40.084472651406
40844938000102,CARLOS RAMIREZ LEMOS CARVALHO,FARMACIA RODRIGUES,RUA,CORONEL AUSTRICLINIO,873,PALMARES,CENTRO,PE,,BAIXADA,-8.685761260981,-35.591735539329
09365087000175,C & P COMERCIO DE MEDICAMENTOS LTDA,FARMACIA SUCESSO,PRACA,DOUTOR PAULO PARANHOS,49,PALMARES,CENTRO,PE,,ATIVA,-8.685431195743,-35.590474849426
06198619003154,DROGATIM DROGARIAS LTDA,FARMACIA PERMANENTE,RUA,DOUTOR FAUSTO FIGUEIREDO,1043,PALMARES,CENTRO,PE,,ATIVA,-8.6806363,-35.5892436
19121427000176,FARMACIA MODELO LTDA,FARMACIA SUCESSO,RUA,DR. FAUSTO FIGUEIREDO,1052,PALMARES,CENTRO,PE,,BAIXADA,-8.686281008965,-35.590532513145
36359779000183,M MARCIA DA SILVA LIMA,FARMACIA EMIBE,AVENIDA,DES. JOAO P. DE CARVALHO,71,PALMEIRINA,CENTRO,PE,,ATIVA,-9.002748650144,-36.325989037182
40877938000109,VICENCIA CAVALCANTE DA SILVA MELO,FARMACIA SAO JOSE,RUA,JOAQUIM NABUCO,150,PALMEIRINA,CENTRO,PE,,ATIVA,-9.002174613533,-36.324573828059
07672886000169,FARMACIA SAUDE DO FIEL TRABALHADOR LTDA,,RUA,JOSE IDALINO,14,SAIRE,CENTRO,PE,,ATIVA,-8.329341506012,-35.709191793402
11750616000520,FW4 ADMINISTRADORA E COMERCIO DE PRODUTOS FARMACEUTICOS LTDA,FARMA FACIL,RUA,CESARIO FALCAO,22,PANELAS,CENTRO,PE,,ATIVA,-8.663445247943,-36.006636473905
08310574000178,FLAVIO DINIZ LIMA DROGARIA LTDA,FARMACIA PARANATAMA,AVENIDA,05,LT 1-B,AGUAS LINDAS DE GOIAS,PARQUE DA BARRAGEM SETOR 11,GO,,INAPTA,-15.751956913505,-48.282794192565
09099316000157,PAULO SERGIO MELO DA ROCHA,POUPE JA,RODOVIA,BR 423 - POVOADO ALTO DA SERRA,17,PARANATAMA,POVOADO ALTO DA SERRA,PE,,ATIVA,-8.916284749322,-36.706476033893
08015802000187,FARMACIA SANTAHELENA LTDA,FARMACIA SANTA HELENA,RUA,PRIMEIRO DE MAIO,58,PASSIRA,CENTRO,PE,,ATIVA,-7.982221973598,-35.587288136159
12822524000147,LOURDES FARMACIA LTDA,LOURDES FARMACIA,RUA,GABRIEL PEREIRA,98,PASSIRA,CENTRO,PE,,ATIVA,-7.980958810513,-35.580754690983
06370315000107,M B DE MELO ARAGAO & CIA LTDA,,RUA,SEVERINO FONTES,13,PASSIRA,CENTRO,PE,,ATIVA,-7.847771338123,-35.229678483925
40840654000148,M F RANGEL LTDA,,RUA,PADRE EMIDIO,234,PAUDALHO,CENTRO,PE,,ATIVA,-7.899140484118,-35.175637609873
10484672000173,V MARCOS DA SILVA & CIA FARMACIA LTDA,FARMACIA SAO MARCOS,RUA,SENADOR PINHEIRO RAMOS,291,PAUDALHO,CENTRO,PE,,ATIVA,-7.896824163635,-35.177765585802
02991393000178,VALMIR J DA SILVA,FARMACIA SAO SEBASTIAO,RUA,DR. ANTONIO MONTENEGRO,56,PAUDALHO,CENTRO,PE,,ATIVA,-7.897136067016,-35.176589227542
10921446000102,WILSON JOSE DE HOLANDA FARMACIA,FARMACIA SHALOM,AVENIDA,GERCINA MARIA RIBEIRO,17,PAUDALHO,CHA DE CRUZ,PE,,ATIVA,-7.8993424,-35.1752708
83754234025901,DISTRIBUIDORA BIG BENN SA FALIDO,,AVENIDA,DOUTOR CLAUDIO JOSE GUEIROS LEITE,1738,PAULISTA,JANGA,PE,,INAPTA,-7.942492191608,-34.824919461376
