CNPJ,Nome,Fantasia,Tipo_Logradouro,Logradouro,Número,Município,Bairro,UF,Telefone,Situação,Latitude,Longitude
24500985000182,GEISE BANDEIRA DE MELO AQUINO,FARMACIA BARATAO DOS MEDICAMENTOS,RUA,RUA DO COMERCIO,60,CUITEGI,CENTRO,PB,,ATIVA,-6.897302361368,-35.524312023678
07322508000155,JANICLEIA GABRIEL SILVA DO NASCIMENTO,FARMACIA SAO SEBASTIAO,RUA,SAO SEBASTIAO,S/N,CURRAL DE CIMA,ESTACADA,PB,,ATIVA,-6.718879,-35.266697
11507532000136,MENEZES GABRIEL DA SILVA,FAMACIA SAO MIGUEL,RUA,JOAO CAXIAS,22,CURRAL DE CIMA,CENTRO,PB,,ATIVA,-6.719068539965,-35.26648581896
04289958000103,REGINALDO BARBOSA DE MELO,DROGARIA FREI DAMIAO,RUA,MANOEL INACIO DA SILVA,28,DAMIAO,CENTRO,PB,,ATIVA,-6.634559004848,-35.904227941551
03991756000138,ALMEIDA COMERCIO DE PRODUTOS FARMACEUTICOS LTDA,SOLON PHARMA,RUA,CONEGO FLORENTINO,S/N,DESTERRO,CENTRO,PB,,ATIVA,-7.288857364023,-37.089677408895
04786985000183,MARIA DE LOURDES SOUZA FARMACIA,,RUA,FRANCISCO LEITE FERREIRA,S/N,DESTERRO,CENTRO,PB,,ATIVA,-7.288598578357,-37.086005392581
36124903000121,CHEILA JUVINO DE SOUZA,DROGARIA DIAMANTE,RUA,GERVAZIO PEGADO,44,DIAMANTE,CENTRO,PB,,ATIVA,-7.427424407422,-38.264105609666
35581701000146,ROSILEIDE RODRIGUES DA SILVA,FARMACIA POPULAR,RUA,ANA DA CONCEICAO DE MELO,135,DONA INES,CENTRO,PB,,ATIVA,-6.605394907405,-35.627404223726
03766689000158,SIMAO E NEVES COMERCIO DE MEDICAMENTOS LTDA,DUNAMIS FARMA,RUA,JOSE CELINO FILHO,229,EMAS,CENTRO,PB,,ATIVA,-7.108090626737,-37.716012244861
08522971000103,BATISTA E MEDEIROS LTDA,FARMAVIDA,RUA,MANOEL RODRIGUES,107,ESPERANCA,CENTRO,PB,,ATIVA,-7.019185034595,-35.858043118102
07179323000133,CRISTIANE DINIZ COSTA DELGADO,ESPERANCAFARMA,RUA,MANOEL RODRIGUES DE OLIVEIRA,173 B,ESPERANCA,CENTRO,PB,,ATIVA,-7.019091298347,-35.858196940207
03629081000181,JOSEILSON DE ANDRADE,FARMACIA POPULAR DE ESPERANCA,RUA,TOMAZ RODRIGUES,285,ESPERANCA,CENTRO,PB,,ATIVA,-7.021234761304,-35.858272454109
70097530001076,NELFARMA COMERCIO DE PRODUTOS QUIMICOS LTDA,REDEPHARMA,RUA,MANOEL RODRIGUES DE OLIVEIRA,97,ESPERANCA,CENTRO,PB,,ATIVA,-7.01948231413,-35.857780694895
11551566000209,ERINALDO JOSE PEREIRA,,RUA,QUEBRA QUILOS,13,FAGUNDES,CENTRO,PB,,ATIVA,-7.220710035876,-35.87523733076
01851050000145,DEUZICLEIDE FARMACIA LTDA,DEUZIFARMA,RUA,FRANCISCO CLAUDIANO,39,FREI MARTINHO,CENTRO,PB,,ATIVA,-6.40359879287,-36.454276111607
00958548000904,DROGARIA DROGAVISTA LTDA,REDEPHARMA,AVENIDA,DOM PEDRO II,517,GUARABIRA,CENTRO,PB,,ATIVA,-6.852641098431,-35.490960696946
09535714000179,EZILDO AQUINO DOS SANTOS,FARMACIA BARATAO DOS MEDICAMENTOS,AVENIDA,DOM PEDRO II,421,GUARABIRA,CENTRO,PB,,ATIVA,-6.853241012608,-35.490313604825
08815100000269,INTERFARMA COMERCIO DE PRODUTOS FARMACEUTICOS LTDA,VAREJAO INTERFARMA,RUA,DOM PEDRO II,247,GUARABIRA,CENTRO,PB,,ATIVA,-6.851991190672,-35.491274062601
08815100000188,INTERFARMA COMERCIO DE PRODUTOS FARMACEUTICOS LTDA,INTERFARMA DRUGSTORE,RUA,JOSE AMERICO,19,GUARABIRA,NORDESTE,PB,,ATIVA,-6.854725487928,-35.484724731876
35569094000107,F. ECONOMICA LTDA,,RUA,JOSE ALVARES TRIGUEIRO,390,GUARABIRA,CENTRO,PB,,ATIVA,-6.848463615911,-35.493826870866
07652280000161,RODRIGO ROCHA DE LIMA,FARMACIA GUARABIRENSE,AVENIDA,PADRE INACIO DE ALMEIDA,525,GUARABIRA,CENTRO,PB,,ATIVA,-6.846767556168,-35.488020270865
03084112000166,SAUDE COMERCIO DE MEDICAMENTOS E PERFUMARIA LTDA,IDEAL FARMA,PRACA,FERREIRA DE MELO,10,GUARABIRA,CENTRO,PB,,ATIVA,-6.851769319243,-35.492722988817
11201331000106,WILMA DE LIMA REGIS,,RUA,DO MERCADO,62,GURINHEM,CENTRO,PB,,ATIVA,-7.125705985303,-35.42464633457
17235744000198,FARMACIA CANTALICE LTDA,FARMACIA CANTALICE,RUA,ANTONIO COUTINHO,SN,GURJAO,CENTRO,PB,,ATIVA,-7.239212711453,-35.889021095768
03466787000170,JOCIELMA RAMALHO FERRAZ,FARMAVIDA,RUA,- JOAQUIM LOPES RIBEIRO,202,IBIARA,CENTRO,PB,,ATIVA,-7.500108479289,-38.404324165734
03627721000114,NUBIA INACIO DE QUEIROZ,,RUA,OSORIO PINTO RAMALHO,351,IBIARA,CENTRO,PB,,ATIVA,-7.498647094471,-38.403905741127
09037814000175,FARMACIA ALANA LEITE LTDA,CENTER FARMA,RUA,ANTONIO CAETANO,62,IMACULADA,CENTRO,PB,,ATIVA,-7.390005236471,-37.508363230363
04561398000196,SUELI CAETANO DE BRITO,,RUA,JOAQUIM BEZERRA,SN,IMACULADA,CENTRO,PB,,ATIVA,-7.3903649336,-37.510604753127
09161993000158,DRUGSTORE INGA FARMACIA E DROGARIA LTDA,"FARMACIA, DROGARIA E DRUGSTORE INGA",PRACA,ANTENOR NAVARRO,89,INGA,CENTRO,PB,,ATIVA,-7.289210721555,-35.60859060899
06971511000137,FARMACIA UNIDAS LTDA,,AVENIDA,JOSE SILVEIRA,113,ITABAIANA,CENTRO,PB,,ATIVA,-7.328626181618,-35.333531459483
17232006000197,MACKSUEL CAVALCANTE DO NASCIMENTO COMERCIO VAREJISTA DE MEDICAMENTOS LTDA,IFARMA,AVENIDA,PRESIDENTE JOAO PESSOA,136,ITABAIANA,CENTRO,PB,,ATIVA,-7.328679135106,-35.333913999009
08011952000112,CENTRAL FARMA COMERCIO VAREJISTA DE MEDICAMENTOS LTDA,,AVENIDA,PRESIDENTE JOAO PESSOA,276,ITABAIANA,CENTRO,PB,,ATIVA,-7.329369571629,-35.3349634564
12447259000164,BELLA VISTA PHARMA COMERCIO VAREJISTA DE MEDICAMENTOS LTDA,PHARMA BELLA VISTA,RUA,TENENTE IRINEU LACERDA,22,CURRAL VELHO,CENTRO,PB,,ATIVA,-7.536467841318,-38.197975362489
08601197000126,TOLENTINO COMERCIO DE PRODUTOS FARMACEUTICOS LTDA,DROGARIA LUIZA,AVENIDA,AV PRESIDENTE GETULIO VARGAS,290,ITAPORANGA,CENTRO,PB,,ATIVA,-27.414892256809,-49.6023892356
11971243000193,DENISE WANESKA DE OLIVEIRA COSTA CARVALHO,BELLA FARMA,AVENIDA,GETULIO VARGAS,228,ITAPORANGA,CENTRO,PB,,ATIVA,-7.3041234,-38.1547714
41197559000130,ITAPORANGA PRODUTOS FARMACEUTICOS LTDA,ITA FARMA,AVENIDA,GETULIO VARGAS,207,ITAPORANGA,CENTRO,PB,,ATIVA,-7.3041234,-38.1547714
35435007000110,MIUZZI COMERCIO VAREJISTA LTDA,MIUZZI TUDO O QUE VOCE PRECISA,AVENIDA,GETULIO VARGAS,290,ITAPORANGA,CENTRO,PB,,BAIXADA,-7.3041234,-38.1547714
05537417000101,DROGARIA SOARES DO REGO LTDA,FARMACIA SOARES,RUA,FREI DAMIAO DE BOZZANO,13,ITAPOROROCA,CENTRO,PB,,ATIVA,-6.829595156431,-35.247111769309
04962146000179,FARMACIA SANTA TEREZINHA LTDA,FARMACIA SANTA TEREZINHA I,RUA,CONEGO FAUSTINO JORGE DE CARVALHO,129,ITAPOROROCA,BAIRRO DO CRUZEIRO,PB,,INAPTA,-6.8293203,-35.2471783
11515713000104,ITAFARMA LTDA,ITAFARMA,RUA,JOSE RODRIGUES DE CARVALHO,67,ITAPOROROCA,CENTRO,PB,,ATIVA,-6.823471193417,-35.242609493569
11092932000128,MARIA DAS GRACAS SOUZA DA SILVEIRA & CIA LTDA,FARMACIA NOSSA SENHORA DE FATIMA,TRAVESSA,PAULO RODRIGUES,05,ITAPOROROCA,CENTRO,PB,,ATIVA,-6.828767697713,-35.247372284181
01999852000105,MARIA JOSENE DE ARRUDA ANDRADE,FARMACENTER,PRACA,ZACARIAS DIAS DE ARAUJO,73,ITATUBA,CENTRO,PB,,ATIVA,-7.376587945746,-35.627340114547
05853325000130,DROGARIA FIRMO E FIRMO LTDA,FARMACIA NOSSA SENHORA DA FATIMA,RUA,PRESIDENTE JOAO PESSOA,196,JACARAU,CENTRO,PB,,ATIVA,-6.620893381182,-35.285090659831
09253493000146,JOSEFA FERNANDES DE ANDRADE,FARMACIA FREI DAMIAO,RUA,MARGARIDA DIAS,140,JACARAU,CENTRO,PB,,ATIVA,-6.617108381641,-35.293364876552
05951119000163,DROGARIA NOVA VIDA LTDA,DROGARIA NOVA VIDA,RUA,ERUNDINA DE OLIVEIRA,113,JERICO,CENTRO,PB,,ATIVA,-6.554564502975,-37.807198934382
09223181000190,EUCLIDES VIANA DE FREITAS NETO,,RUA,BERNARDINO DE FREITAS,84,JERICO,CENTRO,PB,,ATIVA,-6.554976730552,-37.808439322668
17691985000141,MAIS FARMA COMERCIO VAREJISTA DE MEDICAMENTOS LTDA,MAIS FARMA,RUA,JOSE MESQUITA,275,JERICO,CENTRO,PB,,ATIVA,-7.110106425473,-34.868167837573
07827964000157,A & S COMERCIO DE PRODUTOS FARMACEUTICOS LTDA,MED PHARMA - FARMACIA JARDIM,RUA,BENICIO DE OLIVEIRA LIMA,S/N,JOAO PESSOA,JOSE AMERICO DE ALMEIDA,PB,,ATIVA,-7.168145354087,-34.855114967197
05507756000145,ACLIM FARMACIA LTDA,FARMACIA CASTELO BRANCO,RUA,APOLONIO NOBREGA,27,JOAO PESSOA,CASTELO BRANCO,PB,,ATIVA,-7.130150383865,-34.844646563215
12406304000132,ADRIANO NUNES BEZERRA,FARMANUNES,RUA,VEREADOR CICERO SOARES,229,AMPARO,CENTRO,PB,,ATIVA,-7.567766885292,-37.06115051328
12871776000166,FARMACIA LOPES COSTA LTDA,FARMACIA SAO LUIZ,RUA,DOMINGOS MARANHAO,162,CONDE,CENTRO,PB,,ATIVA,-7.263974073993,-34.909118346647
05410369000196,ARCHIMEDES RIBEIRO DA SILVEIRA,DROGARIA PRIMEIRO DE MAIO,AVENIDA,PRIMEIRO DE MAIO,701,JOAO PESSOA,JAGUARIBE,PB,,ATIVA,-7.134442983101,-34.873608052951
10487119000194,AZEVEDO MEDICAMENTOS GENERICOS LTDA,VAREJAO DOS MEDICAMENTOS,AVENIDA,CRUZ DAS ARMAS,3130,JOAO PESSOA,OITIZEIRO,PB,,ATIVA,-7.158844929377,-34.896323191287
35490200000316,CAMILA FARMA COMERCIO DE MEDICAMENTOS LTDA,CAMILA FARMA,RUA,JULIA RIBEIRO,295,JOAO PESSOA,CRISTO REDENTOR,PB,,ATIVA,-7.157555412912,-34.877216317136
41225186000164,CARNEIRO DE FREITAS & CIA LTDA,FARMACIA FREITAS,RUA,FRANCISCO P RIBEIRO,2581,JOAO PESSOA,MANGABEIRA IV,PB,,ATIVA,-7.184757100039,-34.838877215441
08734185000170,OLIVIA MARIA LEITE DE CARVALHO COSTA,FARMACIA CENTRAL,AVENIDA,CRUZ DAS ARMAS,707,JOAO PESSOA,CRUZ DAS ARMAS,PB,,ATIVA,-7.138900084951,-34.888245367859
10398077000115,CATOLE MEDICAMENTOS GENERICOS LTDA,VAREJAO DOS MEDICAMENTOS,RUA,"CEL JOSE CEZARINO DA NOBREGA,",30,JOAO PESSOA,BANCARIOS,PB,,ATIVA,-7.148263802355,-34.84463147579
07207981000191,COELHO FARMA PRODUTOS FARMACEUTICOS LTDA,FARMACIA SAO LUIZ,AVENIDA,CRUZ DAS ARMAS,734,JOAO PESSOA,CRUZ DAS ARMAS,PB,,ATIVA,-7.138990483777,-34.888577961777
02457466000146,COMERCIAL DE PRODUTOS FARMACEUTICOS DINIZ LTDA,FARMACIA DINIZ,RUA,LEOPOLDO PEREIRA LIMA,396,JOAO PESSOA,MANGABEIRA,PB,,ATIVA,-7.17890753972,-34.831837491541
05230009002903,COMERCIAL DRUGSTORE LTDA,FARMACIA PERMANENTE,PRACA,MIL OITOCENTOS E DEZESSETE,16,JOAO PESSOA,CENTRO,PB,,ATIVA,-7.12016171176,-34.883493080215
05230009002741,COMERCIAL DRUGSTORE LTDA,FARMACIA PERMANENTE,RUA,EDSON FALCONI DE MELO,555,JOAO PESSOA,AEROCLUBE,PB,,ATIVA,-7.087689888332,-34.845786154442
05230009000455,COMERCIAL DRUGSTORE LTDA,FARMACIA PERMANENTE,AVENIDA,MAR VERMELHO,128,CABEDELO,INTERMARES,PB,,ATIVA,-7.044989233858,-34.842236244872
05230009002822,COMERCIAL DRUGSTORE LTDA,FARMACIA PERMANENTE,AVENIDA,PRESIDENTE EPITACIO PESSOA,402,JOAO PESSOA,TORRE,PB,,ATIVA,-7.119970520549,-34.866873107323
07287332000148,MOURA LIMA COMERCIO DE MEDICAMENTOS LTDA,FARMACIA DA GENTE,RUA,RUI ANDRADE DA COSTA JUNIOR,144,JOAO PESSOA,MANGABEIRA,PB,,ATIVA,-7.174169501786,-34.840730745887
47508411138344,COMPANHIA BRASILEIRA DE DISTRIBUICAO,,AVENIDA,EPITACIO PESSOA,1277,JOAO PESSOA,TORRE,PB,,BAIXADA,-7.119575900547,-34.858291463395
08637588000109,CRUZ DAS ARMAS MEDICAMENTOS GENERICOS LTDA,FARMACIA CENTRAL DA PARAIBA,RUA,JOSEFA TAVEIRA,1307,JOAO PESSOA,MANGABEIRA,PB,,ATIVA,-7.173517806071,-34.840073313024
05107855000130,DROGARIA BEIRAMAR LTDA,DROGARIA BEIRAMAR,AVENIDA,GOVERNADOR ARGEMIRO DE FIGUEIREDO,2941,JOAO PESSOA,JARDIM OCEANIA,PB,,ATIVA,-7.082676155654,-34.832232494635
00958548000653,DROGARIA DROGAVISTA LTDA,REDEPHARMA,AVENIDA,GOVERNADOR FLAVIO RIBEIRO COUTINHO,445,JOAO PESSOA,MANAIRA,PB,,ATIVA,-7.097570219588,-34.837237798999
00958548001200,DROGARIA DROGAVISTA LTDA,REDEPHARMA,AVENIDA,PRESIDENTE EPITACIO PESSOA,514,JOAO PESSOA,TORRE,PB,,ATIVA,-7.119965784773,-34.865892424651
10940955000182,DROGARIA FIGUEIREDO LTDA,DROGARIA FIGUEIREDO,RUA,MARIANGELA LUCENA PEIXOTO,1282,JOAO PESSOA,VALENTINA DE FIGUEIREDO,PB,,ATIVA,-7.204879409263,-34.849611415923
17239173000160,DROGARIA GOMES FERNANDES LTDA,DROGARIA GEISEL II,QUADRA,QUADRA 15,03,AGUAS LINDAS DE GOIAS,JARDIM AMERICA III,GO,,INAPTA,-15.744485433372,-48.249553457752
00148073000125,DROGARIA JARDIM LTDA,PHARMANUTRI,AVENIDA,MANDACARU,347,JOAO PESSOA,CIDADE PADRE ZE,PB,,ATIVA,-7.107439407663,-34.868958021919
06369621000123,DROGARIA L R LTDA,DROGARIA FIGUEIREDO,RUA,FLODOALDO PEIXOTO,648,JOAO PESSOA,VALENTINA FIGUEIREDO,PB,,ATIVA,-7.199014088697,-34.854134290877
11496533000122,DROGARIA NORDESTE LTDA,DROGARIA NORDESTE,RUA,RUA MARIA JOSE MIRANDA DO AMARAL,241,JOAO PESSOA,JARDIM VENEZA,PB,,ATIVA,-7.170582315157,-34.912684371237
06198619005289,DROGATIM DROGARIAS LTDA,,AVENIDA,VISCONDE DE PELOTAS,189,JOAO PESSOA,CENTRO,PB,,ATIVA,-7.118312412462,-34.882982203217
06198619005360,DROGATIM DROGARIAS LTDA,FARMACIA PERMANENTE,AVENIDA,WALFREDO MACEDO BRANDAO,822,JOAO PESSOA,JARDIM CIDADE UNIVERSITARIA,PB,,ATIVA,-7.155981481614,-34.83870932592
06198619006170,DROGATIM DROGARIAS LTDA,FARMACIA PERMANENTE,AVENIDA,VALDEMAR NAZIAZENO,920,JOAO PESSOA,JOAO PAULO II,PB,,ATIVA,-7.177732947746,-34.873858823702
06198619003073,DROGATIM DROGARIAS LTDA,FARMACIA PERMANENTE,AVENIDA,COMENDADOR GUSTAVO PAIVA,2990,MACEIO,MANGABEIRAS,AL,,ATIVA,-9.638150065565,-35.704362455566
06198619001968,DROGATIM DROGARIAS LTDA,,AVENIDA,GOV ARGEMIRO DE FIGUEIREDO,59,JOAO PESSOA,JARDIM OCEANIA,PB,,ATIVA,-7.096816015941,-34.834960771182
06198619001704,DROGATIM DROGARIAS LTDA,FARMACIA PERMANENTE,RUA,JOAO LOMBARDI,37,JOAO PESSOA,JOSE AMERICO DE ALMEIDA,PB,,ATIVA,-7.166904484465,-34.858902001222
06198619002263,DROGATIM DROGARIAS LTDA,FARMACIA PERMANENTE,RUA,MANOEL ARRUDA CAVALCANTI,805,JOAO PESSOA,MANAIRA,PB,,ATIVA,-7.099184113135,-34.844635834379
06198619003740,DROGATIM DROGARIAS LTDA,FARMACIA PERMANENTE,RUA,JOSEFA TAVEIRA,1173,JOAO PESSOA,MANGABEIRA,PB,,ATIVA,-7.172421285497,-34.839506696369
06198619000724,DROGATIM DROGARIAS LTDA,FARMACIA PERMANENTE,AVENIDA,JOAQUIM TORRES,573,JOAO PESSOA,TORRE,PB,,ATIVA,-7.125205442678,-34.86704442319
06198619002000,DROGATIM DROGARIAS LTDA,FARMACIA PERMANENTE,AVENIDA,PRESIDENTE EPITACIO PESSOA,1648,JOAO PESSOA,TORRE,PB,,ATIVA,-7.119889090359,-34.855467264939
00654809000137,BELFARMA COMERCIO DE MEDICAMENTOS LTDA,FARMACIA BELFARMA,AVENIDA,FRATERNIDADE,691,JOAO PESSOA,CRISTO REDENTOR,PB,,ATIVA,-7.153919407704,-34.883107764126
07764196000130,ELYMED COMERCIO DE MEDICAMENTOS E PERFUMARIA LTDA,VAREJAO DOS MEDICAMENTOS,RUA,"VISCONDE DE PELOTAS,",161,JOAO PESSOA,CENTRO,PB,,ATIVA,-7.11816287931,-34.882856307031
06626253045414,EMPREENDIMENTOS PAGUE MENOS S/A,FARMACIAS PAGUE MENOS,AVENIDA,SANTA CATARINA,1100,JOAO PESSOA,BAIRRO DOS ESTADOS,PB,,ATIVA,-7.11183818854,-34.859121439447
06626253026037,EMPREENDIMENTOS PAGUE MENOS S/A,FARMACIA PAGUE MENOS,AVENIDA,AFONSO PENA,769,JOAO PESSOA,BESSA,PB,,ATIVA,-7.066817603571,-34.839857814293
06626253012087,EMPREENDIMENTOS PAGUE MENOS S/A,FARMACIA PAGUE MENOS,AVENIDA,DUARTE DA SILVEIRA,620,JOAO PESSOA,CENTRO,PB,,ATIVA,-7.122672301309,-34.872632061538
06626253011358,EMPREENDIMENTOS PAGUE MENOS S/A,FARMACIA PAGUE MENOS,PRACA,1817,58,JOAO PESSOA,CENTRO,PB,,ATIVA,-7.120073210712,-34.882830880623
06626253014969,EMPREENDIMENTOS PAGUE MENOS S/A,FARMACIA PAGUE MENOS,AVENIDA,CRUZ DAS ARMAS,3002,JOAO PESSOA,CIDADE DOS FUNCIONAR,PB,,ATIVA,-7.157632297444,-34.896363324903
06626253043047,EMPREENDIMENTOS PAGUE MENOS S/A,FARMACIA PAGUE MENOS,RUA,WALFREDO MACEDO BRANDAO,850,JOAO PESSOA,JARDIM CIDADE UNIVERSITARIA,PB,,ATIVA,-7.156591684165,-34.838615113329
06626253008802,EMPREENDIMENTOS PAGUE MENOS S/A,FARMACIA PAGUE MENOS,AVENIDA,GOVERNADOR ARGEMIRO DE FIGUEIREDO,13,JOAO PESSOA,JARDIM OCEANIA,PB,,ATIVA,-7.089478488094,-34.834328059088
06626253020853,EMPREENDIMENTOS PAGUE MENOS S/A,FARMACIA PAGUE MENOS,RUA,EMPRESARIO JOAO RODRIGUES ALVES,704,JOAO PESSOA,JD C. UNIVERSITARIA,PB,,ATIVA,-7.148284799023,-34.844214392288
06626253013210,EMPREENDIMENTOS PAGUE MENOS S/A,FARMACIA PAGUE MENOS,AVENIDA,GOVERNADOR FLAVIO RIBEIRO COUTINHO,1179,JOAO PESSOA,MANAIRA,PB,,ATIVA,-7.098040611994,-34.844102074785
06626253045333,EMPREENDIMENTOS PAGUE MENOS S/A,FARMACIAS PAGUE MENOS,AVENIDA,SENADOR RUY CARNEIRO,198,JOAO PESSOA,MANAIRA,PB,,ATIVA,-7.110464687976,-34.825256287505
06626253063587,EMPREENDIMENTOS PAGUE MENOS S/A,FARMACIA PAGUE MENOS,RUA,JOSEFA TAVEIRA,438,JOAO PESSOA,MANGABEIRA,PB,,ATIVA,-7.166072273753,-34.838536301972
06626253011943,EMPREENDIMENTOS PAGUE MENOS S/A,FARMACIA PAGUE MENOS,AVENIDA,JOSEFA TAVEIRA,932,JOAO PESSOA,MANGABEIRA I,PB,,ATIVA,-7.170352003151,-34.838959022816
06626253013059,EMPREENDIMENTOS PAGUE MENOS S/A,FARMACIA PAGUE MENOS,RUA,JULIO COUCEIRO,135,JOAO PESSOA,MIRAMAR,PB,,ATIVA,-7.118613,-34.8334009
06626253019928,EMPREENDIMENTOS PAGUE MENOS S/A,FARMACIA PAGUE MENOS,RUA,TITO SILVA,23,JOAO PESSOA,MIRAMAR,PB,,ATIVA,-7.122329179854,-34.836355788259
06626253012672,EMPREENDIMENTOS PAGUE MENOS S/A,FARMACIA PAGUE MENOS,AVENIDA,EPITACIO PESSOA,468,JOAO PESSOA,TORRE,PB,,ATIVA,-7.120113683455,-34.866254774326
10472742000173,ERONILDO DE MELO SILVA,FARMACIA MULTIPHARMA,AVENIDA,CRUZ DAS ARMAS,3042,JOAO PESSOA,OITIZEIRO,PB,,ATIVA,-7.158061492796,-34.896376484491
02508312000136,FARMACIA ALENCAR LTDA,,RUA,ANA PALITOT RAMALHO,89,JOAO PESSOA,MANGABEIRA II,PB,,ATIVA,-7.182084907397,-34.842371966151
02508312000217,FARMACIA ALENCAR LTDA,FARMACIA ALENCAR,RUA,RODOPIANO FERREIRA DA NOBREGA,S/N,JOAO PESSOA,MANGABEIRA II,PB,,ATIVA,-7.179044935994,-34.840610748248
41201138000136,FARMACIA REDEMED BANCARIOS LTDA,FARMACIA REDEMED,RUA,EMPRESARIO JOAO RODRIGUES ALVES,360,JOAO PESSOA,JARDIM SAO PAULO,PB,,ATIVA,-7.147142597077,-34.847175886318
09358797000259,FARMACIA BEIRA RIO LTDA,,AVENIDA,MARCIONILA DA CONCEICAO,1258,JOAO PESSOA,CABO BRANCO,PB,,BAIXADA,-7.120175919086,-34.825989787851
09358797000178,FARMACIA BEIRA RIO LTDA,,AVENIDA,MINISTRO JOSE AMERICO DE ALMEIDA,484,JOAO PESSOA,TORRE,PB,,ATIVA,-7.125603746533,-34.865715231043
09179518000109,FARMACIA CRISTO REI LTDA,FARMACIAS GASTE MENOS,RUA,COMERCIANTE ALFREDO FERREIRA ROCHA,318,JOAO PESSOA,MANGABEIRA,PB,,ATIVA,-7.165051203764,-34.842300133241
18223424000180,FARMACIA E DROGARIA FALCAO LTDA,DROGARIAS VIVA BEM,RUA,MARIA FLORENTINA CALIXTO,12,JOAO PESSOA,CUIA,PB,,INAPTA,-7.18664160333,-34.868980317781
10201708000164,FARMACIA M & E MEDICAMENTOS LTDA,FARMACIA AMIGA,AVENIDA,DOM MANOL PAIVA,266,JOAO PESSOA,MANDACARU,PB,,ATIVA,-7.108717983174,-34.858852715631
41150657000112,FARMACIA MACENA LTDA,VAREJAO DOS MEDICAMENTOS,AVENIDA,JOSEFA TAVERA,457,JOAO PESSOA,MANGABEIRA I,PB,,ATIVA,-7.166169894471,-34.838284866343
24294829000102,FARMACIA MAMANGUAPE LTDA,,AVENIDA,CRUZ DAS ARMAS,562,JOAO PESSOA,CRUZ DAS ARMAS,PB,,ATIVA,-7.137457894691,-34.887634997669
24293912000167,FARMACIA MARCELLA LTDA,,AVENIDA,EPITACIO PESSOA,4648,JOAO PESSOA,TAMBAU,PB,,ATIVA,-7.119766588844,-34.828962094537
13757665000196,FARMACIA MELHOR OPCAO LTDA,DROGARIA MAIS SUL,RUA,IGREJA DE SAO FRANCISCO,88,JOAO PESSOA,GRAMAME,PB,,ATIVA,-7.196587779185,-34.884459178375
15010480000149,FARMACIA MELHOR PRECO LTDA,FARMACIA MELHOR PRECO,RUA,JOAO MARIA DE ARAUJO,271,JOAO PESSOA,GRAMAME,PB,,ATIVA,-7.213547216569,-34.846276969567
12663019000105,FARMACIA MICHELLE LTDA,FARMACIA MICHELLE,RUA,SEVERINO B DE MORAIS,19,JOAO PESSOA,CONJ FUNCIONARIO II,PB,,ATIVA,-7.184636107266,-34.880905670524
24121873000110,FARMACIA SANTA SOFIA LTDA,DROGARIA JOAO PESSOA,AVENIDA,BARAO DE MAMANGUAPE,680,JOAO PESSOA,TORRE,PB,,ATIVA,-7.12529608846,-34.864045975201
41146994000136,FARMACIA SAO LUIZ LTDA,,AVENIDA,CRUZ DAS ARMAS,801,JOAO PESSOA,CRUZ DAS ARMAS,PB,,ATIVA,-7.139648295538,-34.888691788022
35503820000180,FARMACIA SAO MATEUS LTDA,,RUA,CEL JOCA VELHO,190,JOAO PESSOA,AUTO DO MATEUS,PB,,ATIVA,-7.137283383467,-34.911881664261
08320590000141,FARMACIA TABAJARA LTDA,,,PRC JOAO PESSOA,01,JOAO PESSOA,CENTRO,PB,,ATIVA,-7.121807581118,-34.884208259115
40979320000150,FARMACIA TROPICANA LTDA,FARMACIA TROPICANA,RUA,RODRIGUES CHAVES,200,JOAO PESSOA,CENTRO,PB,,ATIVA,-7.125077991339,-34.885752673673
00257973000100,FARMACIA VINTE E SEIS DE JULHO LTDA,FARMACIA 26 DE JULHO,RUA,JULIA RIBEIRO,280,JOAO PESSOA,CRISTO REDENTOR,PB,,ATIVA,-7.155331506932,-34.875065160391
02373671000123,FARMAFLORA MEDICAMENTOS LTDA,,AVENIDA,NOSSA SENHORA DOS NAVEGANTES,370,JOAO PESSOA,TAMBAU,PB,,ATIVA,-7.114398105589,-34.824641139631
35491968000142,FAUSTINO E FAUSTINO COMERCIAL FARMACEUTICO LTDA,FARMACIA FAUSTINO,AVENIDA,EXPEDICIONARIOS,279,JOAO PESSOA,EXPEDICIONARIOS,PB,,ATIVA,-7.122243608871,-34.855075159508
07386761000172,FLAFARMA COMERCIO DE MEDICAMENTOS LTDA,VAREJAO DOS MEDICAMENTOS,AVENIDA,JOAQUIM PIRES FERREIRA,584,JOAO PESSOA,BAIRRO DOS ESTADOS,PB,,ATIVA,-7.110389394266,-34.855763506862
03208714000188,FLAVIO FIGUEIREDO DA SILVA PASCOAL LTDA,FARMACIA FRANCY,RUA,JOSE HOLMES,230,JOAO PESSOA,ERNANI SATIRO,PB,,ATIVA,-7.174751119304,-34.892949627197
18295820000113,FORMIGA & MELO LTDA,FARMACIA MARCELA,RUA,FUNCIONARIO PUBLICO PAULO ANTONIO BASTOS PORTELA (,12,JOAO PESSOA,VALENTINA DE FIGUEIREDO,PB,,INAPTA,-7.208009798642,-34.850528899045
40956591000190,GEANE NUCIA DA SILVA ALVES,FARMANUCIA,RUA,ABDON CHIANCA,25,JOAO PESSOA,ESTADOS,PB,,ATIVA,-7.106898397723,-34.856372426663
08334624000157,GEISEL MEDICAMENTOS GENERICOS LTDA,VAREJAO DOS MEDICAMENTOS,AVENIDA,VALDEMAR GALDINO NAZIAZENO,990,JOAO PESSOA,GEISEL,PB,,ATIVA,-7.178871136015,-34.873766836963
08401713000250,GENIEZER PEREIRA & CIA LTDA,,AVENIDA,AFONSO PENA,261,JOAO PESSOA,BESSA,PB,,ATIVA,-7.07067688325,-34.835885127464
08401713000179,GENIEZER PEREIRA & CIA LTDA,FARMACIA ESPERANCA,AVENIDA,ESPERANCA,1165,JOAO PESSOA,MANAIRA,PB,,ATIVA,-7.1057585008,-34.834039264747
11186328000160,VAREJAO EPITACIO MEDICAMENTOS GENERICOS LTDA,VAREJAO DOS MEDICAMENTOS,RUA,ELIAS PEREIRA DE ARAUJO,100,JOAO PESSOA,MANGABEIRA,PB,,ATIVA,-7.172362989361,-34.842405158487
06995819000112,GRACEFARMA COMERCIO DE MEDICAMENTOS LTDA,VAREJO DOS MEDICAMENTOS,RUA,FELICIANO DOURADO,312,JOAO PESSOA,TORRE,PB,,ATIVA,-7.126090106147,-34.863812706835
08015391000120,GROTAO MEDICAMENTOS GENERICOS LTDA,VAREJAO DOS MEDICAMENTOS,AVENIDA,VEREADOR GENIVAL GUEDES DE MENEZES,683,BAYEUX,MARIO ANDREAZZA,PB,,ATIVA,-7.145511177472,-34.923998700815
10673506000115,IS MEDICAMENTOS GENERICOS LTDA,VAREJAO DOS MEDICAMENTOS,PRAÇA,1817,112,JOAO PESSOA,CENTRO,PB,,ATIVA,-7.120073210712,-34.882830880623
35580737000105,JOSE LENILSON DE LIMA,FARMACIA CENTRAL,AVENIDA,DOM PEDRO II,S/N,JOAO PESSOA,CENTRO,PB,,ATIVA,-7.122895850075,-34.878170637282
02502558000109,JOSELITA MACHADO GALVAO,FARMACIA RAFAELA,RUA,ESPEDITO DELMIRO SANTOS,51,JOAO PESSOA,GROTAO,PB,,ATIVA,-7.186280510941,-34.883030734436
18287949000180,JVA COMERCIO DE MEDICAMENTOS LTDA,FARMACIA HEBROM,RUA,JOSE DE CARVALHO COSTA FILHO,271,JOAO PESSOA,GRAMAME,PB,,BAIXADA,-7.206026514622,-34.871641907316
19012225000196,K & K PRODUTOS FARMACEUTICOS LTDA,FARMACIA VERDE VIDA,RUA,OTACILIO COUTINHO,276,JOAO PESSOA,ERNESTO GEISEL,PB,,ATIVA,-7.176762134616,-34.864336038762
08588008000122,LOURENCO E SILVA LTDA,FARMACIA DO TRABALHADOR DA PARAIBA,RUA,NAPOLEAO DURE,271,JOAO PESSOA,CRISTO REDENTOR,PB,,ATIVA,-7.164855402505,-34.870294264923
05933237000149,MAIS SAUDE FARMA LTDA,MAIS SAUDE FARMA,AVENIDA,EPITACIO PESSOA,5000,JOAO PESSOA,CABO BRANCO,PB,,ATIVA,-7.119599202238,-34.826016526123
08364864000102,MANAIRA MEDICAMENTOS GENERICOS LTDA,VAREJAO DOS MEDICAMENTOS,AVENIDA,GOVERNADOR FLAVIO RIBEIRO COUTINHO,167,JOAO PESSOA,MANAIRA,PB,,ATIVA,-7.097412094985,-34.834930261054
00526987000182,FARMASANTOS COMERCIO DE MEDICAMENTOS LTDA,FARMASANTOS,RUA,ADERBAL PIRAGIBE,446,JOAO PESSOA,JAGUARIBE,PB,,ATIVA,-7.132036689265,-34.880375766605
35582774000233,MARCONI EDSON RIBEIRO DA SILVA,FARMACIA SANTANA,AVENIDA,JULIA FREIRE,1156,JOAO PESSOA,TORRE,PB,,ATIVA,-7.121256094948,-34.855354193065
35582774000152,MARCONI EDSON RIBEIRO DA SILVA,DROGARIA SANTANA,AVENIDA,JULIA FREIRE,763,JOAO PESSOA,TORRE,PB,,ATIVA,-7.121033597328,-34.858947934051
19549764000169,FARMACIAS NORDESTINA LTDA,FARMACIAS NORDESTINA,RUA,FUNCIONARIO PUBLICO PAULO ANTONIO BASTOS PORTELA,454,JOAO PESSOA,VALENTINA DE FIGUEIREDO,PB,,ATIVA,-7.211947468216,-34.850710383778
06181052000198,MARIA JOSE DE ARAUJO SILVA CUNHA,CITY FARMA,RUA,MASCARENHAS DE MORAIS,408,JOAO PESSOA,MANDACARU,PB,,ATIVA,-7.107200104328,-34.859623599266
70115183000176,DROGARIA REDEMED BESSA LTDA,REDEMED,AVENIDA,PRESIDENTE AFONSO PENA,261,JOAO PESSOA,BESSA,PB,,ATIVA,-7.07067688325,-34.835885127464
08046255000105,OITIZEIRO MEDICAMENTOS GENERICOS LTDA,VAREJAO DOS MEDICAMENTOS,AVENIDA,CRUZ DAS ARMAS,3142,JOAO PESSOA,FUNCIONARIOS,PB,,ATIVA,-7.158508290145,-34.896278332405
35581750000189,FARMACIA PRECO BAIXO LTDA,FARMACIA SAO LUIZ,RUA,PADRE AZEVEDO,426,JOAO PESSOA,VARADOURO,PB,,ATIVA,-7.118634319454,-34.888384423632
08822296000138,DROGARIAS ULTRA POPULAR PARAIBA LTDA,DROGARIAS ULTRA POPULAR,RUA,PRESIDENTE JOAO PESSOA,911,PEDRAS DE FOGO,CENTRO,PB,,ATIVA,-7.214866224543,-35.893233571319
11607345000124,PROSIND MEDICAMENTOS GENERICOS LTDA,FARMACIA KAGEANE,AVENIDA,JOAO PESSOA,519,SANTA RITA,MUNICIPIOS,PB,,ATIVA,-7.149571085884,-34.965474631156
12668422000119,R S COMERCIO DE DROGAS LTDA,FARMACIA GENESIS,RUA,AVELINA DOS SANTOS,954,JOAO PESSOA,VALENTINA,PB,,ATIVA,-7.205975217375,-34.846854775607
05042330000163,R T COMERCIO DE DROGAS LTDA,FARMACIA GENESIS,RUA,MARIANGELA LUCENA PEIXOTO,239,JOAO PESSOA,VALENTINA DE FIGUEIREDO,PB,,ATIVA,-7.199014382064,-34.851433893131
07979889000140,RANGEL MEDICAMENTOS GENERICOS LTDA,VAREJAO DOS MEDICAMENTOS,AVENIDA,DOIS DE FEVEREIRO,1167,JOAO PESSOA,RANGEL,PB,,ATIVA,-7.147709698787,-34.873804689749
14645738000110,RCR COMERCIO DE MEDICAMENTOS LTDA,DROGARIA GEISEL,QUADRA,QUADRA 14,06,AGUAS LINDAS DE GOIAS,JARDIM AGUAS LINDAS II,GO,,INAPTA,-15.772803092961,-48.243914144225
14645738000200,RCR COMERCIO DE MEDICAMENTOS LTDA,DROGARIA GROTAO,RUA,ESPEDITO BELMIRO DOS SANTOS,39,JOAO PESSOA,GROTAO,PB,,INAPTA,-7.186411981092,-34.883036685587
01486101000349,REDEPHARMA LTDA,FARMACIA REDEPHARMA,AVENIDA,GOVERNADOR FLAVIO RIBEIRO COUTINHO,445,JOAO PESSOA,MANAIRA,PB,,ATIVA,-7.097570219588,-34.837237798999
01486101000934,REDEPHARMA LTDA,REDEPHARMA,AVENIDA,GOVERNADOR FLAVIO RIBEIRO COUTINHO,445,JOAO PESSOA,MANAIRA,PB,,ATIVA,-7.097570219588,-34.837237798999
17591303000129,PRM COMERCIO DE MEDICAMENTOS LTDA,FARMACIA SAUDE,RUA,JOSEFA TAVEIRA,1637,JOAO PESSOA,MANGABEIRA III,PB,,ATIVA,-7.176461991471,-34.840452594143
18093073000130,OLIVEIRA COMERCIO DE MEDICAMENTOS LTDA,,RUA,MASCARENHAS DE MORAIS,601,JOAO PESSOA,ESTADOS,PB,,ATIVA,-7.106977703033,-34.858045744642
18409931000103,SOARES COMERCIO DE MEDICAMENTOS E PERFUMARIA LTDA,DROGARIA FARMASUL,RUA,SIBIPIRUNA,834,JOAO PESSOA,PARATIBE,PB,,ATIVA,-7.201348752581,-34.833293665482
09119271000135,IVANILDA VIEIRA DE BRITO,POUPE MAIS FARMA,RUA,DAS UMBURANAS,190,CAMPINA GRANDE,MALVINAS,PB,,ATIVA,-7.247719693579,-35.924775905872
05893663000104,TAMBIA MEDICAMENTOS LTDA,MAISFARMA SHOPPING TAMBIA,RUA,ODON BEZERRA,184,JOAO PESSOA,CENTRO,PB,,ATIVA,-7.115230646245,-34.879584536044
