CNPJ,Nome,Fantasia,Tipo_Logradouro,Logradouro,Número,Município,Bairro,UF,Telefone,Situação,Latitude,Longitude
12080502000159,TERTULINA FERREIRA,FARMACIA MADRE TEREZA,AVENIDA,WALDEMAR GALDINO NAZIANZENO,1050,JOAO PESSOA,CONJUNTO ERNESTO GEISEL,PB,,ATIVA,-7.179468693917,-34.873746273429
09266103000172,TORRE MEDICAMENTOS GENERICOS LTDA,VAREJAO DOS MEDICAMENTOS,AVENIDA,FELICIANO DOURADO,328,JOAO PESSOA,TORRE,PB,,ATIVA,-7.129244805035,-34.856689356722
08097217000173,VALENTINA MEDICAMENTOS GENERICOS LTDA,VAREJAO DOS MEDICAMENTOS,RUA,INSPETORA EMILIA MENDONCA GOMES,396,JOAO PESSOA,VALENTINA DE FIGUEIREDO,PB,,ATIVA,-7.204962390105,-34.843398833109
13201612000194,VANDELSON RIBEIRO CARNEIRO,,RUA,JOAO FERNANDES VIEIRA,97,JOAO PESSOA,ALTO DO CEU,PB,,ATIVA,-7.097205900167,-34.863342398248
11456743000197,VENANCIO NEIVA MEDICAMENTOS GENERICOS LTDA,FARMACIA DO TRABALHADOR POPULAR,RUA,PROFESSOR JOSE HOLMES,269,JOAO PESSOA,ERNANI SATIRO,PB,,ATIVA,-7.174534405197,-34.892564059651
18096983000177,VERA LUCIA MOREIRA DE OLIVEIRA SARMENTO,FARMACIA REWEL FARMA,RUA,UNIVERSITARIO EDVALDO DA SILVEIRA ANDRADE,135,JOAO PESSOA,FUNCIONARIOS,PB,,ATIVA,-7.182522211111,-34.881589833741
02412164000151,W R COMERCIO E REPRESENTACAO DE MEDICAMENTOS E PERFUMARIA LTDA,FARMACIA ECONOMICA,RUA,JOSEFA TAVERA,1976,JOAO PESSOA,MANGABEIRA,PB,,ATIVA,-7.1628558,-34.8383097
13719718000184,FARMACIA 1 DE MAIO LTDA,FARMACIA 1 DE MAIO,RUA,PEDRO ANACLETO DE ANDRADE,02,JOCA CLAUDINO,CENTRO,PB,,ATIVA,-6.482508545208,-38.479485842149
09490095000143,EDUARDO FERNANDES DE OLIVEIRA,,PRACA,FLORIANO PEIXOTO,36,JUAZEIRINHO,CENTRO,PB,,ATIVA,-7.068538145264,-36.578725497267
05437369000180,NATERCIO ASSIS PRODUTOS FARMACEUTICOS LTDA,DROGARIA ANA PAULA,RUA,RUA VEREADOR PAULO COSME DE OLIVEIRA,18,JUAZEIRINHO,CENTRO,PB,,ATIVA,-7.0687083,-36.5756836
18829239000134,DROGARIA CENTRAL JUNCO DO SERIDO LTDA,DROGARIA CENTRAL,AVENIDA,AVENIDA BALDUINO GUEDES,754,JUNCO DO SERIDO,CENTRO,PB,,ATIVA,-6.995475140909,-36.714065430116
00778570000107,ANTONIO VELOSO FERREIRA,,RUA,SAO PAULO,84,JURIPIRANGA,CENTRO,PB,,ATIVA,-7.372426291371,-35.238245105983
14087523000121,MICHAEL CAVALCANTE DO NASCIMENTO,CENTRALFARMA,AVENIDA,BRASIL,415,JURIPIRANGA,CENTRO,PB,,ATIVA,-7.374591256571,-35.240714655776
03710748000176,AILSON TIBURTINO ALVES,FARMACIA SANTA TEREZINHA,RUA,TERTULIANA ALVES,89,JURU,CENTRO,PB,,ATIVA,-7.538152093784,-37.817639558491
09063793000162,MANOEL SIMOA DE LIMA,FARMACIA LIMA,AVENIDA,DALMO TEIXEIRA,21,JURU,CENTRO,PB,,ATIVA,-7.540977027555,-37.820222708179
11176210000151,MARCONILDE SIMOA OLIVEIRA,ENY FARMA,RUA,CEL. MANOEL F. DE MEDEIROS,300,JURU,CENTRO,PB,,ATIVA,-7.537080969902,-37.818300591821
01903497000110,ALANDELON CUSTODIO DA SILVA,FARMACIA CUSTODIO,RUA,TEN. JOSE PEDRO,38,LAGOA,CENTRO,PB,,ATIVA,-6.590721186526,-37.915376740468
02778480000141,EDILSON GOMES DE LUNA,DROGARIA GOMES,RUA,DO COMERCIO,40,LAGOA DE DENTRO,CENTRO,PB,,ATIVA,-6.673068481811,-35.377276779794
07131879000230,EDMY GOMES DE LUNA,DROGARIA SAUDE,RUA,13 DE MAIO,06,LAGOA DE DENTRO,CENTRO,PB,,ATIVA,-6.671911401987,-35.379579875329
18727845000149,FARMACIA AGRA LTDA,FARMACIA CABRAL,RUA,FRANCISCO CAMILO,345,CAMPINA GRANDE,CATOLE,PB,,ATIVA,-7.229925918966,-35.877692324984
04923356000158,FARIAS COMERCIO VAREJISTA DE MEDICAMENTOS LTDA,FARMALAGOS,RUA,CICERO FAUSTINO DA SILVA,163,LAGOA SECA,CENTRO,PB,,ATIVA,-7.157804000731,-35.854608982734
10591868000167,R & B COMERCIO VAREJISTA DE MEDICAMENTOS LTDA,FARMA CENTRO,RUA,CICERO FAUSTINO DA SILVA,559,LAGOA SECA,CENTRO,PB,,ATIVA,-7.158220595884,-35.854992923736
10582057000108,OLIVEIRA DROGARIA LTDA,FARMAFREITAS,RUA,BERNARDINO DE FREITAS,80,JERICO,CENTRO,PB,,ATIVA,-6.554999236996,-37.808459403817
13483259000182,DJAIR DE JESUS FALCAO,DJAPHARMA,RUA,PRESIDENTE JOAO PESSOA,69,LIVRAMENTO,CENTRO,PB,,ATIVA,-6.974545590102,-34.837173928897
10201441000105,LIBIA VILAR QUEIROZ DOS SANTOS,FARMA-SANTOS,RUA,PRESIDENTE JOAO PESSOA,135,LIVRAMENTO,CENTRO,PB,,ATIVA,-6.975718727824,-34.836535715149
31663969000176,LOGRADOURO COMERCIAL DE PRODUTOS FARMACEUTICOS LTDA,FARMACIA PARAIBA,AVENIDA,FRANCISCO GOMES,396,LOGRADOURO,CENTRO,PB,,ATIVA,-6.616225331596,-35.439423444539
19502598000145,RISONILDO CAVALCANTE DA CRUZ,FARMACIA KAGEANE,RUA,DAVID DE SOUZA FALCAO,630,LUCENA,CENTRO,PB,,ATIVA,-6.902482988869,-34.873804628112
09391809000166,TEREZINHA CANUTO MORAIS,FARMACIA CANUTO,RUA,ANGELO CUSTODIO,748,LUCENA,FAGUNDES,PB,,ATIVA,-6.930491698352,-34.868626051544
43210383000135,FARMACIA NOSSA SENHORA DE FATIMA MEDICAMENTOS LTDA,FARMACIA NOSSA SENHORA DE FATIMA,RUA,LUIZ FURTADO DE FIGUEIREDO,38,MAE D'AGUA,CENTRO,PB,,ATIVA,-7.259572604103,-37.426852323458
01639797000134,JOANA MARIA DE SOUSA MEDEIROS,MAGAZINE SOUSA MEDEIROS,RUA,- CEL. JOSE FERNANDES VIEIRA,74,MALTA,CENTRO,PB,,ATIVA,-6.906122019201,-37.519790200518
03674214000131,MARINEIDE CAVALCANTE DE MEDEIROS,DIFARMA,RUA,MONSENHOR VALERIANO PEREIRA,S/N,MALTA,CENTRO,PB,,ATIVA,-6.904478249943,-37.517254911772
01643510000140,MELO E LIMA COMERCIO LTDA,FARMACIA ECONOMICA II,RUA,DOM VITAL,34,MAMANGUAPE,CENTRO,PB,,ATIVA,-6.838356823067,-35.133684144098
04138386000153,FARMAGUAPE MEDICAMENTOS LTDA,FARMACIA MAMANGUAPE,PRACA,25 DE OUTUBRO,29,MAMANGUAPE,CENTRO,PB,,ATIVA,-6.831058435852,-35.122642148092
03405630000134,JANEIDE ARAUJO DE LIMA MELO,FARMACIA ECONOMICA,RUA,PRESIDENTE JOAO PESSOA,50,MAMANGUAPE,CENTRO,PB,,ATIVA,-6.836277000988,-35.122483402003
00970693000145,RITA DE CASSIA ROSA DE AQUINO CUNHA,DROGARIA SANTA RITA,RUA,SEN RUI CARNEIRO,S/N,MAMANGUAPE,CENTRO,PB,,ATIVA,-6.845442260904,-35.13068985308
40940017000143,VALE COMERCIO DE MEDICAMENTOS LTDA,FARMACIA DO TRABALHADOR DO VALE,AVENIDA,SENADOR RUI CARNEIRO,SN,MAMANGUAPE,BEATRIZ MENEZES,PB,,ATIVA,-6.844511300719,-35.130272402954
41118175000185,MWLT II - COMERCIO DE MEDICAMENTOS E PERFUMARIA LTDA,IDEAL FARMA,PRACA,PRESIDENTE JOAO PESSOA,28,ALAGOINHA,CENTRO,PB,,ATIVA,-7.029482720899,-37.276019164024
03109768000196,FARMACIA TOTAL LTDA,FARMACIA TOTAL,AVENIDA,COMENDADOR RENATO RIBEIRO COUTINHO,1461,SAPE,CENTRO,PB,,ATIVA,-7.0978583,-35.2304083
14635449000130,CICERA FURTADO LEITE,FARMACIA DOS APOSENTADOS,RUA,JOSE ROSAS,245,MANAIRA,CENTRO,PB,,ATIVA,-7.166422601352,-34.843167510521
08603052000164,LUIZ TAVARES DE LIMA,FARMACIA FREI DAMIAO,TRAVESSA,PADRE TAVARES,18,MANAIRA,CENTRO,PB,,ATIVA,-7.706647658653,-38.154170549275
10798410000264,ARLINDO ALVES DE VASCONCELOS NETTO,FARMACIA NOVA FARMA,AVENIDA,JOAO FERREIRA SANTOS,98,MARCACAO,CENTRO,PB,,ATIVA,-6.7705286,-35.016629
08944346000230,FARMACIA DROGA CENTRO DRUGSTORES LTDA,FARMACIA DROGA CENTRO DRUGSTORES,RUA,ANTONIO DE LUNA FREIRE,129,MARI,CENTRO,PB,,BAIXADA,-7.059473,-35.310623
10849068000101,FARMACIA MARIENSE NOSSA SENHORA APARECIDA LTDA,DROGARIA NOSSA SENHORA APARECIDA,AVENIDA,ANTONIO DE LUNA FREIRE,296,MARI,CENTRO,PB,,ATIVA,-7.06041081206,-35.317993338834
10904478000108,FRANCISCO EDNE ALMEIDA CARTAXO LTDA,FARMACIA SAO JOSE,RUA,RUA BELARMINO RUFINO DE CARVALHO,18,MARIZOPOLIS,CENTRO,PB,,ATIVA,-6.844266344738,-38.348759833538
03948826000175,FARMACIA SANTO ANTONIO LTDA,FARMCIA SANTO ANTONIO,RUA,DR. OTAVIO MARIZ,39,MARIZOPOLIS,CENTRO,PB,,ATIVA,-6.843890791323,-38.346261361553
10954417000147,MACIEL E ANDRADE COMERCIO DE MEDICAMENTOS LTDA,FARMACIA MULT-MED,RUA,ROGACIANO NUNES,05,MASSARANDUBA,CENTRO,PB,,ATIVA,-7.180625492325,-35.735417732846
02675956000119,EDNA PEREIRA DE LIMA ROCHA,FARMACIA ROCHA,RUA,JOAO SOARES DA COSTA,S/N,MATARACA,PLANALTO 2,PB,,ATIVA,-6.595434917414,-35.056123740532
01353021000153,MARIA JOSE DA SILVA FILHA - FARMACIA,FARMACIA VIDA NOVA,RUA,JOAO SOARES DA COSTA,1017,MATARACA,PLANALTO II,PB,,ATIVA,-6.593641986416,-35.057058071279
03605485000135,L M FARMA PRODUTOS FARMACEUTICOS E PERFUMARIA LTDA,FARMACIA FREI DAMIAO,AVENIDA,JOSE GERONIMO,595,MATUREIA,CENTRO,PB,,ATIVA,-7.265035916975,-37.345383395363
09223967000107,FREIRE E CLEMENTINO COMERCIO VAREJISTA DE MEDICAMENTOS LTDA,FARMACIA NOSSA SENHORA PERPETUO DO SOCORRO,RUA,PRESIDENTE JOAO PESSOA,69,MOGEIRO,CENTRO,PB,,ATIVA,-7.3036318928,-35.477216690087
12570087000111,J A COMERCIO VAREJISTA DE MEDICAMENTOS LTDA,J A COMERCIO VAREJISTA DE MEDICAMENTOS LTDA,RUA,JOSE SILVEIRA,SN,MOGEIRO,CENTRO,PB,,ATIVA,-7.350623532414,-35.421638118768
12057497000163,REGILANE OLIVEIRA DINIZ,FARMACIA DINIZ,RUA,MANOEL CIRINO LIRA,24,MONTADAS,CENTRO,PB,,ATIVA,-7.087794143869,-35.959128515354
36063038000150,FARMACIA SANTO REMEDIO LTDA,FARMACIA SANTO REMEDIO,RUA,JOSE DIAS DE LIMA,46,MONTE HOREBE,SAO JOSE,PB,,ATIVA,-7.215494285358,-38.586378130977
15361228000184,PEREIRA DIAS & CAVALCANTI LTDA ME,FARMACIA BEM ESTAR,RUA,JOSE BASILIO BRAGA,233,MONTE HOREBE,CENTRO,PB,,ATIVA,-7.214227031393,-38.585881383706
04227119000152,ENEDINA ALVES FERREIRA,FARMAMED,RUA,SIZENANDO RAFAEL,234,MONTEIRO,CENTRO,PB,,ATIVA,-7.891441345451,-37.117961611461
05408069000172,H P - MEDICAMENTOS LTDA,,RUA,DR GILVERSON DE ARAUJO CORDEIRO,111,MONTEIRO,CENTRO,PB,,ATIVA,-7.893073374195,-37.121075917004
24513707000160,HELIOSMAN BIDO DA COSTA,,RUA,PADRE ARTUR CAVALCANTE,40,MONTEIRO,CENTRO,PB,,ATIVA,-7.890820061582,-37.122865568829
09161100000174,FARMACIA MENEZES LTDA,FARMACIA MENEZES,RUA,PADRE ARTUR CAVALCANTE,142,MONTEIRO,CENTRO,PB,,ATIVA,-7.891244171908,-37.123687126612
13297764000132,R.P. PRODUTOS FARMACEUTICOS LTDA,FARMACIA R P,AVENIDA,OLIMPIO GOMES,100,MONTEIRO,CENTRO,PB,,BAIXADA,-7.892595915074,-37.126437396336
02090471000163,GILVANILDA BARBOSA DE SOUZA,,RUA,JOAO PESSOA,S/N,NATUBA,CENTRO,PB,,ATIVA,-7.641320210428,-35.551507397967
14513262000164,SOCIEDADE FARMACEUTICA TORRES LTDA,FARMACIA DROGAVIDA,RUA,MANOEL MENDES PEDROSA,01,NAZAREZINHO,CENTRO,PB,,ATIVA,-6.344575541595,-37.741745692958
00388463000172,MARLUCE ALVES DE AGUIAR,FARMACIA SAO SEVERINO,RUA,BENEDITO MARINHO,590,NOVA FLORESTA,CENTRO,PB,,ATIVA,-6.454908790279,-36.203814072629
08933521000103,MARIA APARECIDA DE SOUSA LUIZ,FARMACIA SANTA TEREZINHA,RUA, FRANCISCO PINTO,29,NOVA OLINDA,CENTRO,PB,,ATIVA,-7.480417907852,-38.041757121955
11428392000100,DORALINA ALVES DE AMORIM NETA,MARLIETE FARMA,RUA,ALMISA ROSA,71,NOVA PALMEIRA,CENTRO,PB,,ATIVA,-6.67752441499,-36.418720406007
11994310000195,FARMABRUNO COMERCIO DE MEDICAMENTOS LTDA,FARMABRUNO,RUA,FAUSTO ALMEIDA COSTA,42,OLHO D'AGUA,CENTRO,PB,,ATIVA,-7.228569287997,-37.749354592017
01371104000175,FARMACIA SAO PAULO LTDA,FARMACIA SAO PAULO,RUA,FAUSTO DE ALMEIDA COSTA,11,OLHO D'AGUA,CENTRO,PB,,ATIVA,-7.228614273767,-37.749585185193
10405474000177,WELITON CAVALCANTE DOS SANTOS,,RUA,LARGO TEODOSIO DE OLIVEIRA LEDO,162,OLIVEDOS,CENTRO,PB,,ATIVA,-7.218878838444,-35.886205001424
12406304000213,ADRIANO NUNES BEZERRA,FARMANUNES,RUA,ANTONIO IZIDRO,80,OURO VELHO,CENTRO,PB,,ATIVA,-7.62116674987,-37.150773009165
24690360000201,COMERCIO DE PRODUTOS FARMACEUTICOS REDENCAO LTDA,FARMACIA REDENCAO,RUA,NOSSA SENHORA DA CONCEICAO,90,PASSAGEM,CENTRO,PB,,ATIVA,-7.218480666332,-35.881528768546
09200727000197,ANDRE RICARDO FIGUEIREDO DE ANDRADE,FARMACIA SAO SEBASTIAO,RUA,LIMA CAMPOS,119,PATOS,SAO SEBASTIAO,PB,,ATIVA,-7.017983373389,-37.27105553887
04612555000145,DANYLLO FIGUEIREDO DE ANDRADE,,RUA,DO PRADO,1449,PATOS,CENTRO,PB,,BAIXADA,-7.030385721825,-37.279219281184
07775949000102,DROGARIA SANTANA LTDA,DROGARIA SANTANA,RUA,HILDO MENEZES,163,PATOS,BELA VISTA,PB,,ATIVA,-7.015084497172,-37.281422641725
06626253043470,EMPREENDIMENTOS PAGUE MENOS S/A,FARMACIA PAGUE MENOS,RUA,BOSSUENT WANDERLEY,108,PATOS,CENTRO,PB,,ATIVA,-7.027543949115,-37.277535507026
08561821000109,FARMACIA DROGACENTER LTDA,DROGACENTER,RUA,BOSSUET WANDERLEY,127,PATOS,CENTRO,PB,,ATIVA,-7.027354513773,-37.277350713162
00833140000140,FARMACIA JATOBA LTDA,FARMACIA JATOBA,RUA,MANOEL MOTA,435,PATOS,JATOBA,PB,,ATIVA,-7.049510817532,-37.275356071664
09048753000141,FRANCINALDO FERNANDES GOMES,FARMACIA NOSSA SENHORA DA VITORIA,RUA, ANTONIO FELIX,850,PATOS, VITORIA,PB,,ATIVA,-7.015361016158,-37.271578180264
02093105000400,JOAO ALVES DE ANDRADE NETO,,RUA,HORACIO NOBREGA,449,PATOS,BELO HORIZONTE,PB,,ATIVA,-7.02422072049,-37.285374365464
02093105000168,JOAO ALVES DE ANDRADE NETO,MEGAPHARMA,RUA,DO PRADO,545,PATOS,CENTRO,PB,,ATIVA,-7.030562896761,-37.281414930374
02093105000249,JOAO ALVES DE ANDRADE NETO,,RUA,MANOEL MOTA,200,PATOS,JATOBA,PB,,ATIVA,-7.040960069014,-37.277705635577
02093105000591,JOAO ALVES DE ANDRADE NETO,,RUA,PRESIDENTE EPITACIO PESSOA,227,PATOS,CENTRO,PB,,ATIVA,-7.025573004192,-37.27727330752
02093105000320,JOAO ALVES DE ANDRADE NETO,MEGAPHARMA,RUA,LIMA CAMPOS,398,PATOS,SAO SEBASTIAO,PB,,ATIVA,-7.018240107455,-37.272589908349
10642501000125,JUSSANNYEL GOMES DIAS,FARMACIA DO POVO,RUA,VIOLONISTA ANTONIO MORENO,09,PATOS,NOE TRAJANO,PB,,ATIVA,-7.008896999664,-37.287468435144
70097530000509,NELFARMA COMERCIO DE PRODUTOS QUIMICOS LTDA,NELFARMA.,AVENIDA,PEDRO FIRMINO,116,PATOS,CENTRO,PB,,ATIVA,-7.026751603478,-37.278053535744
18021947000144,MEGAPHARMA COMERCIO VAREJISTA DE MEDICAMENTOS LTDA,DROGARIAS ULTRA POPULAR,RUA,DOUTOR PEDRO FIRMINO,120,PATOS,CENTRO,PB,,ATIVA,-7.025718492002,-37.276012207044
08452858000107,WALMA LAENA FARIAS DE BARROS,WALFARMA,RUA,LEONCIO WANDERLEY,391,PATOS,CENTRO,PB,,ATIVA,-7.028350912513,-37.278452598154
08452858000280,WALMA LAENA FARIAS DE BARROS,WALFARMA,RUA,LIMA CAMPOS,181,PATOS,SAO SEBASTIAO,PB,,ATIVA,-7.018787496266,-37.274274387059
31300512000105,FARMACIA MEGAFARMA PAULISTA LTDA,FARMACIA MEGAFARMA,RUA,CEL JOSE AVELINO,195,PAULISTA,CENTRO,PB,,ATIVA,-6.595923791917,-37.624168385577
05951119000244,DROGARIA NOVA VIDA LTDA,DROGARIA NOVA VIDA LTDA - ME,RUA,JOAO PESSOA,73,PAULISTA,CENTRO,PB,,ATIVA,-6.594981189539,-37.624818605745
08922871000174,PAULO DOUGLAS DE AZEVEDO TEOTONIO LTDA,FARMACIA SANTA LUZIA,AVENIDA,SOLIDONIO LEITE DE OLIVEIRA,706,PEDRA BRANCA,CENTRO,PB,,ATIVA,-7.436647,-38.0694522
09110902000155,DANTAS COMERCIO VAREJISTA DE PRODUTOS FARMACEUTICOS LTDA,DROGARIA DANTAS,RUA,JOSE LINS DO REGO,23,PEDRA LAVRADA,CENTRO,PB,,ATIVA,-6.756729095595,-36.470694624107
10580818000184,FARMACIA PHARMA VIDA LTDA,PHARMA VIDA,RUA,PROFESSOR FRANCISCO FERREIRA,141,PEDRA LAVRADA,CENTRO,PB,,ATIVA,-6.757532582703,-36.469010237254
03421866000164,EDILSON JERONIMO DE MELO,,RUA,PROF. GETULIO CESAR RODRIGUES GUEDES,02,PEDRAS DE FOGO,CENTRO,PB,,ATIVA,-7.402775547225,-35.11474748761
02778480000303,EDILSON GOMES DE LUNA,FARMACIA GOMES,AVENIDA,SEN RUI CARNEIRO,141,PEDRO REGIS,CENTRO,PB,,ATIVA,-7.110637227488,-34.824998380718
00554520000146,FARMACIA FREI DAMIAO LTDA,,RUA,MASCARENHAS DE MORAIS,S/N,PIANCO,CENTRO,PB,,ATIVA,-7.199286913788,-37.925375064928
09310699000160,RITA MARIA GALDINO LOPES,FARMACIA GALDINO,RUA,JOSE AMERICO,256,PIANCO,CENTRO,PB,,ATIVA,-7.126238117936,-34.982855749847
10859239000175,JOSE RONALDO DE OLIVEIRA,FARMACIA SAO LUCAS,RUA,PRESIDENTE GETULIO VARGAS,76,PICUI,CENTRO,PB,,ATIVA,-7.289543224974,-35.609362443956
05584956000100,MARIA DAS GRACAS DANTAS CAVALCANTE,FARMACIA SAO MATEUS,AVENIDA,MARECHAL CASTELO BRANCO,210A,PICUI,MONTE SANTO,PB,,ATIVA,-6.511075075845,-36.35045906776
01698329000130,ZITA MARIA DE OLIVEIRA SILVA,,RUA,GWTULIO VARGAS,81,PICUI,CENTRO,PB,,ATIVA,-7.289439676277,-35.609305974653
00226933000100,DROGARIA MEDEIROS & SILVA LTDA,FARMASAM,RUA,CONEGO TEODOMIRO,163,PILOES,CENTRO,PB,,ATIVA,-6.86739540513,-35.613031301467
39531004000131,AMANDO SILVA MARINHO DOS SANTOS,DROGARIA MAIS,RUA,MANOEL ALVES DE SOUSA,168,PILOEZINHOS,CENTRO,PB,,ATIVA,-6.844260005566,-35.528029310437
07131879000311,EDMY GOMES DE LUNA,FARMACIA MAIS VIDA,RUA,CELSO CIRNE,55,PIRPIRITUBA,CENTRO,PB,,ATIVA,-6.781653295224,-35.496816268058
08580979000126,FARMACIA ESTELINA LTDA,,RUA,CONEGO PEQUENO,S.N,POCINHOS,CENTRO,PB,,ATIVA,-7.076462994737,-36.059918943578
02708218000120,GILDO JOSE DA SILVA,GIL FARMA,RUA,GETULIO VARGAS,17,POCINHOS,CENTRO,PB,,ATIVA,-7.077333413566,-36.059810964418
13719718000265,FARMACIA 1 DE MAIO LTDA,FARMACIA 1 MAIO II,RUA,ODILON FRANCISCO DE OLIVEIRA,58,POCO DANTAS,CENTRO,PB,,ATIVA,-6.404913770719,-38.497370561289
70094891000178,AULIVANIA ANACLETO BARBOSA,ANACLETO FARMA,TRAVESSA,COMERCIAL MOISES BRAZ TORRES,17,POCO DE JOSE DE MOURA,CENTRO,PB,,ATIVA,-6.5739798,-38.511916
11084221000101,EPITACIO QUEIROGA FILHO,FARMACIA QUEIROGA,RUA,TRAVESSA ARGEMIRO DE SOUSA,20,POMBAL,CENTRO,PB,,ATIVA,-6.771866184087,-37.803376576772
11147190000190,G & G COMERCIO DE PRODUTOS FARMACEUTICOS LTDA,BIOFARMA,RUA,TENENTE AURELIO CAVALCANTE,18,POMBAL,CENTRO,PB,,ATIVA,-6.770236234983,-37.802409639581
03166237000135,J.J.G COMERCIO VAREJISTA DE PRODUTOS FARMACEUTICOS LTDA,FARMACIA DOS POBRES,RUA,- TENENTE AURELIO CAVALCANTE,34,POMBAL,CENTRO,PB,,ATIVA,-6.770314690816,-37.802450958014
21041234000157,FARMADANTAS COMERCIO DE MEDICAMENTOS LTDA,FARMADANTAS,RUA,ODILON LOPES,301,POMBAL,JARDIM SANTA ROSA,PB,,ATIVA,-6.767921383844,-37.795525967394
08674952000100,R2 COMERCIO DE MEDICAMENTOS LTDA,FARMACIA KAGEANE,RUA,ENGENHEIRO DE CARVALHO,279,BAYEUX,CENTRO,PB,,ATIVA,-7.128521193344,-34.929856823259
08704443000175,VIRGINIA MARQUES PEREIRA,,RUA,ANTONIO FERNANDES DE ALMEIDA,187,POMBAL,NOVA VIDA,PB,,ATIVA,-6.770341636304,-37.796318689927
07804686000112,VERONICA MARIA NUNES BARROS,FARMACIA FREITAS,RUA,ANANIANO RAMOS GALVAO,109,PRATA,CENTRO,PB,,ATIVA,-7.693036493399,-37.081956566778
04429172000136,FARMACIA IDEAL MUNIZ COMERCIO DE MEDICAMENTOS LTDA,FARMACIA IDEAL,RUA,CORONEL MARCOLINO PEREIRA LIMA,277,PRINCESA ISABEL,CENTRO,PB,,ATIVA,-7.735580902119,-37.993987994809
01750502000100,LUIZ ROBERTO ANTAS,FARMACIA DE MANO,RUA,CEL MARCOLINO PEREIRA LIMA,160,PRINCESA ISABEL,CENTRO,PB,,ATIVA,-7.736477310647,-37.993444696997
13084191000169,FARMACIA ANTAS COMERCIO VAREJISTA DE MEDICAMENTOS LTDA,FARMACIA GALILEIA,RUA,JUAREZ TAVORA,51,PRINCESA ISABEL,CENTRO,PB,,ATIVA,-7.7359529,-37.9940052
02877680000151,DROGARIA ROSA MISTICA LTDA,,RUA,28 DE JANEIRO,36,PUXINANA,CENTRO,PB,,ATIVA,-7.147267527112,-35.963690226681
10414451000129,FLAVIO & BRUNA FARMA LTDA,FLAVIOFARMA,RUA,ANTONIO GOMES DO NASCIMENTO,3,PUXINANA,CENTRO,PB,,ATIVA,-7.14617974943,-35.963034055538
19844411000191,TACIO HASSA DA SILVA LEITE,FARMACIA REDEMED POPULAR,RUA,EUNICE RIBEIRO,74,QUEIMADAS,CENTRO,PB,,ATIVA,-7.360772283893,-35.895443731743
19849216000154,RENATO DOS SANTOS RODRIGUES LTDA,FARMACIA POPULAR,RUA,ODILON ALMEIDA BARRETO,22,QUEIMADAS,CENTRO,PB,,ATIVA,-7.364167420829,-35.901774622454
12939922000148,MARIO CABRAL VITORIO FILHO,FARMACIA REMIGIO DOS REIS,RUA,JOAO PESSOA,50,REMIGIO,CENTRO,PB,,ATIVA,-6.966523899216,-35.795088082457
41127507000198,VALDELENA TOMAZ DANIEL,DROGAS & BULAS,RUA,JOAO PESSOA,08,REMIGIO,CENTRO,PB,,ATIVA,-6.966941820908,-35.795520169565
11869254000167,FARMACIA POPULAR LTDA,FARMACIA POPULAR,RUA,MANOEL TOMAZ DE AQUINO,223,RIACHAO,CENTRO,PB,,ATIVA,-6.536628956368,-35.652146554102
10844868000121,LUZIANE CAVALCANTE DO NASCIMENTO COMERCIO VAREJISTA DE MEDICAMENTOS LTDA,FARMACIA SAO FRANCISCO,RUA,VENANCIO NEIVA,S/N,INGA,CENTRO,PB,,ATIVA,-7.289487094288,-35.612191476679
28995093000150,JOAO DE OLIVEIRA SOUZA,,RUA,JOAO FERREIRA ALVES,SN,RIACHAO DO POCO,CENTRO,PB,,ATIVA,-7.147071524949,-35.266322510064
10870265000102,CICERO APARECIDO ARAUJO DA COSTA LTDA,DROGARIA DROGANOSSA,RUA,MANOEL TRAJANO DE FARIAS,81,RIACHO DOS CAVALOS,JOSE AMERICO,PB,,ATIVA,-6.436832978725,-37.65423847856
08602096000170,M DO SOCORRO VAZ CARNEIRO,,RUA,DR FRANCISCO CARNEIRO,98,RIACHO DOS CAVALOS,CENTRO,PB,,ATIVA,-6.438230433072,-37.6531256864
14140795000148,JANELENE ANDRADE DA SILVA LTDA,FARMACIA SAO JOSE,AVENIDA, MANOEL TRAJANO DE FARIAS,SN,RIACHO DOS CAVALOS,JOSE A DE ALMEIDA,PB,,ATIVA,-6.436832978725,-37.65423847856
10798410000345,ARLINDO ALVES DE VASCONCELOS NETTO,,RUA,DR NAPOLEAO LAUREANO,1034,RIO TINTO,CENTRO,PB,,BAIXADA,-6.806639808606,-35.079647132698
00936950000122,FARMACENTER COMERCIO DE MEDICAMENTOS LTDA,FARMACENTER,TRAVESSA,DA MANGUEIRA,45,RIO TINTO,CENTRO,PB,,ATIVA,-6.810178915349,-35.075953914928
06216726000142,FARMACIA DA FAMILIA PLUS LTDA,FARMACIA MENOR PRECO,TRAVESSA,DA MANGUEIRA,47,RIO TINTO,CENTRO,PB,,ATIVA,-6.810193777779,-35.075946746283
09122571000173,SAUDE FARMA LTDA,SAUDE FARMA,AVENIDA,SANTA ELIZABETE,03,RIO TINTO,CENTRO,PB,,ATIVA,-6.799839927578,-35.0718272201
14943595000123,HELIO LINO DA SILVA,LINO FARMA,RUA,TEREZA BALDUINO DA NOBREGA,SN,ASSUNCAO,CENTRO,PB,,ATIVA,-7.072576287205,-36.724756381474
11016660000187,DROGARIA MILLER LTDA,DROGARIA MILLER,RUA,SEVERIANO MACEDO,203,BOQUEIRAO,CENTRO,PB,,ATIVA,-7.479146564993,-36.129333141334
05023434000120,JOSE ADAILSON ALVES PEREIRA,,SITIO,DOIS RIACHOS,S/N,SALGADO DE SAO FELIX,ZONA RURAL,PB,,ATIVA,-7.3557,-35.445773
38087057000142,MAYARA ALCANTARA DE OLIVEIRA,ALCANFARMA,RUA,MANOEL RODOPIANO DE SALES,40,SANTA CECILIA,CENTRO,PB,,ATIVA,-7.224466492061,-35.909862404647
13444642000121,LEANDRO ALVES PEREIRA,FARMACIA SAO FRANCISCO,RUA,FRANCISCO FANANCA,65,SANTA CRUZ,CENTRO,PB,,ATIVA,-6.532630878315,-38.061366303697
11048957000124,FARMACIA LISBOA E PARNAIBA LTDA,FARMACIA DIA E NOITE,RUA,RUA DO COMERCIO,42,SANTA HELENA,CENTRO,PB,,ATIVA,-6.7218923,-38.6403569
27776936000246,ERNANES DOUGLAS LEITE DE FIGUEIREDO LTDA,DROGARIA NOSSA SENHORA DE FATIMA,RUA,JOAO CARLOS VIEIRA,170,SANTA INES,CENTRO,PB,,ATIVA,-7.627316898321,-38.559181608581
43052339000144,FARMAVITE LTDA,FARMAVITE,RUA,JOAO RODRIGUES DE FRANCA,300,SANTA INES,CENTRO,PB,,ATIVA,-7.628542426555,-38.559378541853
07839945000140,FERNANDO MARINHO DE LIMA JUNIOR,,RUA,FRANCISCO CIRILO DANTAS,239,SANTA LUZIA,CENTRO,PB,,ATIVA,-6.87056295762,-36.92468347708
08103408000109,UNIFARMA COMERCIO DE MEDICAMENTOS LTDA,UNIFARMA,AVENIDA,JOSE AMERICO,501,SANTA LUZIA,SAO JOSE,PB,,ATIVA,-6.872472503165,-36.914807465745
35427343000111,MEDPHARMA COMERCIO DE PRODUTOS FARMACEUTICOS LTDA,MEDPHARMA,AVENIDA,GETULIO VARGAS,190,ITAPORANGA,CENTRO,PB,,ATIVA,-7.3041234,-38.1547714
11893609000153,FERNANDES MORAIS E MEDEIROS LTDA,FARMACIA SANTA CLARA,AVENIDA,JOSE AMERICO DE ALMEIDA,135,SANTA LUZIA,CENTRO,PB,,ATIVA,-6.872540153834,-36.918144786297
08529676000189,ANNE CORALINA DO NASCIMENTO COSTA,FARMACIA KAGEANE,AVENIDA,JOAO PESSOA,10,SANTA RITA,MUNICIPIOS,PB,,ATIVA,-7.146157679706,-34.969142719628
35490200000154,CAMILA FARMA COMERCIO DE MEDICAMENTOS LTDA,CAMILA FARMA,PRACA,ANTENOR NAVARRO,24,SANTA RITA,CENTRO,PB,,ATIVA,-7.123361793811,-34.980750263414
07037376000110,CASSIFARMA COMERCIO VAREJISTA DE MEDICAMENTOS LTDA,ELIZE FARMA,RUA,SAO JOAO,86,SANTA RITA,CENTRO,PB,,ATIVA,-7.122363302448,-34.978887687893
17480426000192,ERICA XAVIER DA SILVA,CENTRAL FARMA,RUA,ANESIO ALVES DE MIRANDA,381,SANTA RITA,VARZEA NOVA,PB,,ATIVA,-7.124917644277,-34.956451626506
17360336000168,EVANDRO DA SILVA VICENTE JUNIOR,ROSI FARMA,RUA,VINTE E DOIS DE MAIO,844,SANTA RITA,POPULAR,PB,,ATIVA,-7.135093904629,-34.978655509175
13751994000120,F.A. COMERCIO VAREJISTA DE PRODUTOS FARMACEUTICOS LTDA,AGENERICA FARMA,AVENIDA,CAMPINA GRANDE,519,SANTA RITA,MUNICIPIOS,PB,,ATIVA,-7.152643514403,-34.966935932155
03208714000692,FLAVIO FIGUEIREDO DA SILVA PASCOAL LTDA,FARMACIA FRANCY,AVENIDA,JOAO PESSOA,345,SANTA RITA,MUNICIPIOS,PB,,ATIVA,-7.148233481894,-34.966897516938
41217779000189,FARMACIA NERIS LTDA,FARMACIA NERIS,RUA,TEIXEIRA,04,SANTA RITA,CONJ TIBIRI II,PB,,ATIVA,-7.151093113772,-34.968438639756
01634818000200,GREICY CRISTIANE DO NASCIMENTO COSTA,FARMACIA NOSSA SENHORA APARECIDA,AVENIDA,JOAO PESSOA,600,SANTA RITA,TIBIRI II,PB,,ATIVA,-7.150152999512,-34.965030641744
02759258000100,HELENITA SARINHO SOARES LIMITADA,HELENITA FARMA,RUA,PROJETADA,19,SANTA RITA,CONJUNTO LEROLANDIA,PB,,ATIVA,-7.163094527049,-34.959308101497
14385506000170,JULIANA PINHEIRO DA SILVA,,AVENIDA,FLAVIO RIBEIRO COUTINHO,135,SANTA RITA,CENTRO,PB,,ATIVA,-7.122844121029,-34.981330332319
18111547000120,R K R PRODUTOS FARMACEUTICOS E PERFUMARIA LTDA,FARMACIA POPULAR,AVENIDA,JOAO PESSOA,490,SANTA RITA,TIBIRI II,PB,,ATIVA,-7.14950390493,-34.965841004143
09424134000104,TIAGO CAMARGO ALVES RANGEL,FARMAVITORIA,RUA,PADRE GERALDO PINTO,02,SANTA RITA,MARCOS MOURA,PB,,ATIVA,-7.16042704316,-34.975413269707
23063634000199,CICERA CAVALCANTE DE OLIVEIRA,FARMACIA CENTRAL,RUA,DO COMERCIO,99,SANTANA DE MANGUEIRA,CENTRO,PB,,ATIVA,-7.5494946,-38.3198293
41148255000183,KATELANDIA DELBORA PAULO LEITE,LABFARMA,RUA,MANOEL BATISTA,SN,SANTANA DOS GARROTES,CENTRO,PB,,ATIVA,-7.384901143019,-37.990181220774
03969925000133,JP2 COMERCIO E SERVICOS DE SAUDE LTDA,FARMACIA JOAO PAULO II - JPFARMA 1,RUA,RUA URSULINA FRANCELINA DE MEDEIROS,18,SANTO ANDRE,CENTRO,PB,,ATIVA,-7.22091298421,-36.632229907733
11162324000142,MARIA DA CONCEICAO FERREIRA DE ALMEIDA,FARMACIA SAO BENTINHO,RUA,ERNANE ROQUE DE ARRUDA,191,SAO BENTINHO,CENTRO,PB,,ATIVA,-6.8906907,-37.7258614
09304606000195,FARMACIA FREITAS LTDA,FARMA FREITAS,RUA,ERNANE ROQUE DE ARRUDA,SN,SAO BENTINHO,CENTRO,PB,,ATIVA,-6.8906907,-37.7258614
35573070000113,DROGARIA SAO BENTO LTDA,,RUA,JOAQUIM RIBEIRO,170,SAO BENTO,CENTRO,PB,,ATIVA,-6.488449760753,-37.44902846432
04500455000127,FARMA FONSECA LTDA,FARMACIA SAO SEBASTIAO,RUA,LUCIO DA SILVA,391,SAO BENTO,CENTRO,PB,,ATIVA,-6.486711407317,-37.447206982911
70096433000178,FARMACIA BENEDITO LTDA,,RUA,JOAQUIM RIBEIRO,194,SAO BENTO,CENTRO,PB,,ATIVA,-6.488418835004,-37.448759030353
10670950000187,JOYCIENE DUTRA DA SILVA,FARMACIA SAO GABRIEL,RUA,JACI CLEMENTINO DA SILVA,407,SAO BENTO,SAO BENTINHO,PB,,ATIVA,-6.46610359308,-37.445834540684
19340911000196,MARIA AUXILIADORA FERREIRA VIEIRA DE OLIVEIRA,FARMACIA SAO DOMINGOS,RUA,JOAQUIM QUEIROGA DE ASSIS,47,SAO DOMINGOS,CENTRO,PB,,ATIVA,-6.816307998642,-37.942223808701
13444642000202,LEANDRO ALVES PEREIRA,FARMACIA SAO FRANCISCO,RUA,JOSE DOMINGOS DE OLIVEIRA,27,SAO FRANCISCO,CENTRO,PB,,ATIVA,-6.620143594509,-38.094705798707
04880543000100,CARIRI - FARMA COMERCIO DE PRODUTOS FARMACEUTICOS LTDA,CARIRI - FARMA,RUA,JORNALISTA JOSE LEAL RAMOS,S/N,SAO JOAO DO CARIRI,CENTRO,PB,,ATIVA,-7.391591236052,-36.532622563032
08873937000264,FARMACIA IDEAL LTDA,FARMACIA IDEAL,RUA,JOAO MEDEIROS RAMOS,SN,SAO JOAO DO CARIRI,CENTRO,PB,,ATIVA,-7.390868,-36.5325964
13071817000100,MARIA AUXILIADORA MEDEIROS DE FREITAS,FARMACIA CENTRAL,RUA,TAB. JOSE CANDIDO DANTAS,311,SAO JOAO DO RIO DO PEIXE,CENTRO,PB,,ATIVA,-6.730114562311,-38.449230337725
